_id,playerId,gameId,createdAt,data.synergyPreference,data.teamViability,data.enjoyedTask,data.age,data.gender,data.strengthInGame,data.payFair,data.feedbackOpenEnded,data.feedbackMultipleChoice,data.education
dzsd2dctTGp2oDbyj,Y5RMRqyxMkafXyjpD,fdexB3xArQ6WpoMz3,2024-04-19T15:51:09Z,individual,false,strongly disagree,,,,,survey never started waist of time.,No,
LY2NyXNYnkEfk2kSg,Y5RMRqyxMkafXyjpD,fdexB3xArQ6WpoMz3,2024-04-19T15:52:23Z,,,,35,Male,Game never started waist of time.,No.,,,high-school
uEfNmaffS2xchLsaZ,tLzS7KRgNPZBYi48b,rkWHNxrSJ3Ei69Kt6,2024-04-19T18:29:36Z,individual,true,neither agree nor disagree,,,,,It got stuck waiting for players so I couldn't play. ,No,
tAtm9NFDM899aqCwE,tLzS7KRgNPZBYi48b,rkWHNxrSJ3Ei69Kt6,2024-04-19T18:30:36Z,,,,42,male,I didn't get to play,I don't know. It depends on if I'm sent a bonus for time spent on the study.,,,high-school
DZuheQZBSTFFbSdS5,NJv6Jh5xqmMzPJxst,3epXP4Y5ugkWYjNTe,2024-04-20T15:38:25Z,team,,agree,,,,,some of the tasks were challenging,Yes,
2unmMpd9jmfGecWN5,NJv6Jh5xqmMzPJxst,3epXP4Y5ugkWYjNTe,2024-04-20T15:39:56Z,,,,70,XY,"average, not enough time to think and consider options",yes in that the directions were clear but some were challenging,,,master
xBhqHQ8KZw9S3F4Jn,Y2Gd3Aqj6E9jQngfd,yovo3RcCBPE9ck6gr,2024-04-20T18:56:01Z,individual,,agree,,,,,"no, all good",Yes,
gkEbS6h7JmRivPJW5,Y2Gd3Aqj6E9jQngfd,yovo3RcCBPE9ck6gr,2024-04-20T18:56:29Z,,,,35,male,working quickly ,yes,,,master
sMDtuYxuPLcJnduWN,FMtjc64Y6yGquwiWg,hk_cf6b348153bd5e34,2024-04-20T19:17:00Z,individual,false,neither agree nor disagree,,,,,None,No,
piGTPhR92Lqc4M64u,rLCyvzPupdSuvhqij,hk_cf6b348153bd5e34,2024-04-20T19:17:05Z,team,true,agree,,,,,its hard working on the same board and communicating,Yes,
p6puFShsaPWbgkhKM,iEtZ7a3HjFPrgwPy4,hk_cf6b348153bd5e34,2024-04-20T19:17:19Z,team,true,strongly agree,,,,,It was a good experience,Yes,
sLyu3stiCSG7nd7rH,FMtjc64Y6yGquwiWg,hk_cf6b348153bd5e34,2024-04-20T19:17:27Z,,,,53,male,Strongest player in most games ,Mostly,,,bachelor
hk_7f1b46d14f650293,6gXMCGvjL23XmaMZj,hk_cf6b348153bd5e34,2024-04-20T19:17:29Z,individual,false,agree,,,,,Short notice on email about game.,No,
bEPCxNYEcSQWhxqnB,6YbMJJrN22Kr9GaHM,hk_cf6b348153bd5e34,2024-04-20T19:17:30Z,individual,true,disagree,,,,,It was frustrating dealing some of the other players because they wouldn't engage with the task or communicate effectively.,No,
crirntwCPqBtAAf85,rLCyvzPupdSuvhqij,hk_cf6b348153bd5e34,2024-04-20T19:17:54Z,,,,33,male,my strengtth was finding a leader,pay wasn't fair because you had to depend on teammates,,,bachelor
24mDeEwyoK6oiYZsX,iEtZ7a3HjFPrgwPy4,hk_cf6b348153bd5e34,2024-04-20T19:18:22Z,,,,26,Male,the sense of understanding of the group,I expected a little more,,,high-school
KQ5sGuMsjr8eKijt3,8knJPk7ZzyQkTssDh,hk_cf6b348153bd5e34,2024-04-20T19:18:43Z,team,true,agree,,,,,"I think it would be better to be notified a day before, rather than some hours. As far as general experience, the instructions were clear and the the team worked well together but I think we would of improved efficiency if there was a ""planning"" round after the practice.",Yes,
hk_3195cc61729eec4b,6YbMJJrN22Kr9GaHM,hk_cf6b348153bd5e34,2024-04-20T19:18:56Z,,,,37,male,I was strong. I did my best to communicate and get everybody to work together. But my teammates let me down by not taking any time to think strategically about how to work together.,"No, the pay should be considerably higher.",,,bachelor
tZZmT7uSsYqrvJcWg,6gXMCGvjL23XmaMZj,hk_cf6b348153bd5e34,2024-04-20T19:19:03Z,,,,68,female,Logic skills,not minimum wage as it turned out.,,,bachelor
KCk864YqahE5ZmNHj,8knJPk7ZzyQkTssDh,hk_cf6b348153bd5e34,2024-04-20T19:20:31Z,,,,36,Male,"My strength were the memory and typing rounds, I felt I did my part in those. ",Yes.,,,high-school
hk_b74a8813e884e87d,y9bZpKELmdfLXEK4L,sYmnLEY99hJd9HxJ8,2024-04-20T19:35:16Z,individual,,agree,,,,,none,Yes,
FjGGYs3cNr96iQShP,y9bZpKELmdfLXEK4L,sYmnLEY99hJd9HxJ8,2024-04-20T19:36:44Z,,,,62,Male,I'm pretty good at anagrams and solving some types of puzzles,yes,,,bachelor
jHbkbA8JLPx2x37gt,8ZC2EpDqXKQsFCS9m,uDqcgecgytLxxs7c3,2024-04-22T13:44:01Z,individual,,strongly disagree,,,,,boring and repetitive. only good for typists,No,
KPerbvBF8Nozv8N53,8ZC2EpDqXKQsFCS9m,uDqcgecgytLxxs7c3,2024-04-22T13:44:25Z,,,,72,male,poor,yes,,,bachelor
hk_de7520a47dc5a5b9,pDBsP5BrQ9mtkr8gu,kQocmc6EuQw7SBRYy,2024-04-22T13:51:09Z,individual,true,strongly disagree,,,,,There was  not enough instructions on the first task to make me feel like I know what I was doing or that I was helping with scoring. It was more frustrating than anything else.,No,
J8fEKqiryNsdq3jzJ,pDBsP5BrQ9mtkr8gu,kQocmc6EuQw7SBRYy,2024-04-22T13:52:06Z,,,,39,Female,Assigning tasks,Sure,,,high-school
xQnAtoLPFavRSg7vR,WJQcemvogkqqKabCF,i6odH2j4TQ2jrPetH,2024-04-22T14:13:06Z,individual,,strongly agree,,,,,Everything worked smoothly. Thank you.,Yes,
eoBpd6jtfQrjEphCy,WJQcemvogkqqKabCF,i6odH2j4TQ2jrPetH,2024-04-22T14:14:21Z,,,,44,Male,I think I did okay at the typing and recall.,Very much so.,,,bachelor
g3LBiozAv2QZ2kXXM,hk_33da5268c8686f93,vZotrcHHJQdDRznyG,2024-04-22T14:30:10Z,individual,,strongly agree,,,,,no,Yes,
ddsH3DCuPYBto2u8z,hk_33da5268c8686f93,vZotrcHHJQdDRznyG,2024-04-22T14:30:48Z,,,,47,F,5 (1-10),Yes,,,bachelor
6Bgf55yYNEzRLK5Bp,EmSp8dvghr5eraKTn,HGbPCT3dyrEACpPqo,2024-04-22T14:35:29Z,team,false,agree,,,,,No,Yes,
duSqwZ8Gt93pbPbJk,rt65SpkzhXcKYBXjH,HGbPCT3dyrEACpPqo,2024-04-22T14:35:57Z,team,false,strongly agree,,,,,none,Yes,
nHqTzHjwjAv8thzJS,HygFiffBdSHCXCh2M,HGbPCT3dyrEACpPqo,2024-04-22T14:36:04Z,team,true,neither agree nor disagree,,,,,my only feedback is that this took an hour and it better have paid $15+,No,
KLMjPLqit2Hqvs7nZ,wJPcJvSN9SpjmtDQQ,HGbPCT3dyrEACpPqo,2024-04-22T14:36:13Z,individual,false,strongly agree,,,,,A BIT OF SHORT NOTICE TO PLAY THE GAMES. ,Yes,
ucX6QEsqQpPMGtYYy,EmSp8dvghr5eraKTn,HGbPCT3dyrEACpPqo,2024-04-22T14:36:21Z,,,,31,male,,Not at all. I feel like we did perfectly one at least 2 of the games and still may only get 5$ for an hour of work,,,bachelor
Kq7ZyJzLjXjERb6Er,rt65SpkzhXcKYBXjH,HGbPCT3dyrEACpPqo,2024-04-22T14:36:34Z,,,,51,male,average,yes,,,bachelor
j7xZoxup84oNs5PWE,HygFiffBdSHCXCh2M,HGbPCT3dyrEACpPqo,2024-04-22T14:36:40Z,,,,39,male,don't have any,no,,,high-school
rd5nvskcDmH5eQThf,wJPcJvSN9SpjmtDQQ,HGbPCT3dyrEACpPqo,2024-04-22T14:36:53Z,,,,69,MALE,VERY POOR COMPARABLE TO THE OTHER MEMBERS OF MY TEAM.,YES,,,high-school
wYMd39C6figsJJJhi,eq43CGyxsQdDsKLwa,F33ksqCfNxGF3v87b,2024-04-22T14:41:59Z,team,false,strongly agree,,,,,na,Yes,
TjRFTd5yrs2ru7i8m,EozTAycwPk8ucWdxR,F33ksqCfNxGF3v87b,2024-04-22T14:42:32Z,team,true,strongly agree,,,,,The game was very interactive and good memory created for me. Thank you,Yes,
z9YnCwcaykHPpXpJo,eq43CGyxsQdDsKLwa,F33ksqCfNxGF3v87b,2024-04-22T14:42:48Z,,,,40,Male,"Positive, energetic,attentive",yes,,,bachelor
LYF7eXsf6Jt2cmDAa,FbReRJA4XNvhRfGEP,vRWAwjmTFPMf5mJGo,2024-04-22T14:42:54Z,team,true,strongly agree,,,,,,Yes,
wMCoXZjWhA2x29Qk6,GE2DpQARZuczY5uTp,vRWAwjmTFPMf5mJGo,2024-04-22T14:42:55Z,individual,true,strongly agree,,,,,No,Yes,
SfA9bayfB8tzN8xvp,FbReRJA4XNvhRfGEP,vRWAwjmTFPMf5mJGo,2024-04-22T14:43:06Z,,,,37,male,,,,,master
cuwc4YjErQ5QCHKGF,abGnuQSrBMsDzu6h7,vRWAwjmTFPMf5mJGo,2024-04-22T14:43:16Z,team,true,strongly agree,,,,,Good,Yes,
aQCDuAYJGed6G5wL2,fqfDDSJ8LtrpMQbFY,vRWAwjmTFPMf5mJGo,2024-04-22T14:43:17Z,team,false,agree,,,,,overall a good experience,Yes,
MsHSYvbRFivxBYTLf,H3d5MvfbF8DWZKghh,vRWAwjmTFPMf5mJGo,2024-04-22T14:43:27Z,team,true,strongly agree,,,,,No issues with the task.  Everything was fine.,Yes,
NiwQnBBMuHjto68wK,aSBFj9ErdnS9pH44j,vRWAwjmTFPMf5mJGo,2024-04-22T14:43:30Z,team,true,strongly agree,,,,,very good,Yes,
vQaaacm83czh7tRRC,EozTAycwPk8ucWdxR,F33ksqCfNxGF3v87b,2024-04-22T14:43:44Z,,,,35,MALE,Pro active was my biggest strength for me .,Yes indeed !,,,bachelor
7L9zTP4fymDkYuBmi,fqfDDSJ8LtrpMQbFY,vRWAwjmTFPMf5mJGo,2024-04-22T14:43:50Z,,,,52,Female,my strength was typing and memory.,Yes,,,high-school
4xdCsK8PyfYo5bZnv,GE2DpQARZuczY5uTp,vRWAwjmTFPMf5mJGo,2024-04-22T14:43:59Z,,,,28,Female,"Average, I think I was better at some things but worse at others",I suppose,,,other
BscfbhcFJNfhw9e8X,5EByokgw2aMS8YnwJ,F33ksqCfNxGF3v87b,2024-04-22T14:44:02Z,individual,false,agree,,,,,"Went quicker than anticipated. Sometimes when we all ""approved,"" we still had to wait, which seemed like wasted time. Other partners were helpful for one game, then not helpful and very lazy with the next. One person was eager to finish, the rest wanted to do well. So, other people a mixed blessing.",Yes,
tvbPNi7oHDxPPgytQ,aSBFj9ErdnS9pH44j,vRWAwjmTFPMf5mJGo,2024-04-22T14:44:23Z,,,,29,female,very good,yes,,,high-school
W4Xs3KkGYpRP9QT6N,abGnuQSrBMsDzu6h7,vRWAwjmTFPMf5mJGo,2024-04-22T14:44:34Z,,,,38,female,typing,yes,,,bachelor
6SyfPkjQ9qazmAGEG,H3d5MvfbF8DWZKghh,vRWAwjmTFPMf5mJGo,2024-04-22T14:45:15Z,,,,47,male,"For the most part, it was about trying to contribute where I could.",I think it's fine.,,,bachelor
Hqz6tFqxYApmnmTQa,5EByokgw2aMS8YnwJ,F33ksqCfNxGF3v87b,2024-04-22T14:45:18Z,,,,47,male,"Quality control. Some people are eager to simply finish, and I feel my strength is making sure the responses are accurate. ",yes,,,bachelor
bXNQsfHmxk8HX9Da6,5ykoBgvAh6QMoeePQ,kQocmc6EuQw7SBRYy,2024-04-22T14:45:25Z,team,false,disagree,,,,,"It was too long and after the first round, I wasn't sure if there was anyone else playing besides me. The instructions in the first round were insufficient as it didn't specify that all of us cannot type different paras at the same time. At least it wasn't possible to do so. If I were to work again, I'd like sufficient instructions and there should be some sort of signal that can tell me which of the players are active, if any. And we should be allowed to work on different parts at the same time. Or maybe given different boards to type our answer but be able to communicate so that we can share our answers. My mturk ID is hk_238e245255cc0c45",No,
YPnPxyC2LMBoNAGvd,5ykoBgvAh6QMoeePQ,kQocmc6EuQw7SBRYy,2024-04-22T14:47:21Z,,,,38,male,I feel that my strength was low in most games.,Not sure.,,,high-school
ojEFJ8pkeXMtZLy6c,WGsAibWDDwm4ebBqd,xsNXxFMngp5kyqaNp,2024-04-22T15:42:37Z,individual,,agree,,,,,I thought parts were difficult. Thank you,Yes,
yukA7YbpHsvfxzATq,WGsAibWDDwm4ebBqd,xsNXxFMngp5kyqaNp,2024-04-22T15:43:18Z,,,,57,female,I did the best I could,yes,,,bachelor
txFHR2wGivPXFC8tT,EAchGjWL5ScFdTeeF,hZof56eeZ7tTaPcWK,2024-04-22T15:51:46Z,individual,,agree,,,,,,Yes,
JgJDTscDkPHLezi64,EAchGjWL5ScFdTeeF,hZof56eeZ7tTaPcWK,2024-04-22T15:52:36Z,,,,67,F,weak,yes,,,master
dXsZBxer5xtvPjaH6,rusBtPEEYBzkH3JFv,bssiYnskJFG9K7CSf,2024-04-22T15:54:34Z,team,true,strongly agree,,,,,This task was not worth the time and there is no guarantee of bonus,No,
oycC3psXwmi4MjaXc,6i4SZXBsiMQauwSBd,bssiYnskJFG9K7CSf,2024-04-22T15:54:40Z,team,false,agree,,,,,,Yes,
PuMZZWhatjKPdNehM,6i4SZXBsiMQauwSBd,bssiYnskJFG9K7CSf,2024-04-22T15:55:03Z,,,,30,female,average,??,,,bachelor
B3REnaiRZ4kpaAGwm,rusBtPEEYBzkH3JFv,bssiYnskJFG9K7CSf,2024-04-22T15:55:21Z,,,,30,prefer not to disclose,I like working in a team and chatting with strangers I don't know,"NO, we should be making the minimum wage in california.",,,other
5gH6WM5RYsARPyRLQ,q6MfvJYH2vpi4qLer,bssiYnskJFG9K7CSf,2024-04-22T15:56:32Z,individual,false,agree,,,,,"Our time was cut short in BOTH of the relationship rounds.  In each round, the timer cut off when there were still 2 minutes left.  What happened?  So, weren't able to complete either one to receive a bonus.  This was very frustrating because it takes me the first 2 minutes of each round to read and understand the relationships in order to mark the gameboard correctly.",Yes,
rKD4Xi9Syj4SBNNCF,q6MfvJYH2vpi4qLer,bssiYnskJFG9K7CSf,2024-04-22T16:00:08Z,,,,52,Female,"I'm a pretty good typist.  But, it was very difficult for 3 people to type at once.","No!  I'm shocked the bonus on this HIT was 4.75  because we spent 1 hour on it.  I don't mean to be rude, but bad requesters on Mturk pay more than this.",,,bachelor
ybpf2YPiFJmeys6gB,zTA2vg9mcjNBFWhZD,CJnHBmP4gtDfpReFi,2024-04-22T16:06:17Z,team,true,strongly agree,,,,,This was a great experience and I enjoyed it a lot.  ,Yes,
BK4kQTak6zjzMDX6z,vyY7wLNJwAgHNgjir,XQbGixwcr8ysHQp3v,2024-04-22T16:06:31Z,team,true,strongly agree,,,,,none,Yes,
8TzzNLXrJKw5azmEG,6RrtkqXWK9Yhi5QDz,CJnHBmP4gtDfpReFi,2024-04-22T16:06:36Z,team,true,agree,,,,,didn't get much advance notice,Yes,
Y7puDY8ZyPpvv3o2F,F5wMfPhMPG3JYCLs3,XQbGixwcr8ysHQp3v,2024-04-22T16:06:51Z,team,true,strongly agree,,,,,all ok,Yes,
SgbfJ8khoyfbEAXJj,zTA2vg9mcjNBFWhZD,CJnHBmP4gtDfpReFi,2024-04-22T16:06:56Z,,,,42,Male,I think I did well on some of the tasks.,I think the pay was reasonable.,,,master
tbn3y4qWGH2b34DM7,KBvK4FBxCSSSqNzCz,XQbGixwcr8ysHQp3v,2024-04-22T16:06:56Z,individual,false,agree,,,,,Annoying to have to wait if one player drops out.,Yes,
7gZkWDtXhswWFGtS3,7rLb8j7t6NT8P2AY9,CJnHBmP4gtDfpReFi,2024-04-22T16:07:08Z,team,true,strongly agree,,,,,"I was a bit confused as i logged on via the link i typed in, and not sure it showed up on Mechanical Turk site",Yes,
uz5FZECsuxHo6EoXN,vyY7wLNJwAgHNgjir,XQbGixwcr8ysHQp3v,2024-04-22T16:07:23Z,,,,62,female,average overall - some better than others,yes,,,bachelor
859Keh3PQxvSDZ3gS,khwwEiK64GqoGsfuB,XQbGixwcr8ysHQp3v,2024-04-22T16:07:32Z,team,true,strongly agree,,,,,"well it needs to have a better notification, because it took alot for us the get into the room and it was not even full.",Yes,
4tXE4ga3y2KdMG99z,bzorbmGTruo2N4wGA,XQbGixwcr8ysHQp3v,2024-04-22T16:07:36Z,team,false,agree,,,,,Some of the puzzles broke my brain. I was glad to have teammates on game 5,Yes,
dgyLixctcxQyjeQ8u,KBvK4FBxCSSSqNzCz,XQbGixwcr8ysHQp3v,2024-04-22T16:07:44Z,,,,43,male,Think my strength was getting along with others and trying to contribute as best as I could.,yes,,,master
xjGPb4WRB8XhQwqsM,6RrtkqXWK9Yhi5QDz,CJnHBmP4gtDfpReFi,2024-04-22T16:07:52Z,,,,67,male,poor!  I'm a horrible typist.,yes,,,master
vtPuyTTa5krXivrnP,khwwEiK64GqoGsfuB,XQbGixwcr8ysHQp3v,2024-04-22T16:08:07Z,,,,32,Male,"It was normal, like a support, not a leader.",the pay is fair for the time.,,,high-school
j73kgxHSt7PZypXmb,7rLb8j7t6NT8P2AY9,CJnHBmP4gtDfpReFi,2024-04-22T16:08:08Z,,,,73,Female,"mid range, depending on the task",yes. very fun to play for bonuses and work with others,,,bachelor
Cg7qhFewRZcEitgk4,F5wMfPhMPG3JYCLs3,XQbGixwcr8ysHQp3v,2024-04-22T16:08:08Z,,,,40,male,I was fast,Yes,,,bachelor
teZPYRpeCwEvt84fM,bzorbmGTruo2N4wGA,XQbGixwcr8ysHQp3v,2024-04-22T16:08:37Z,,,,57,male,"good on some, poor on game 5",yes,,,bachelor
ChoaQHkaZF8yQmmLd,md3cRHQfF5jZD4ATk,xTX5xzEvtebxqa9Sd,2024-04-22T16:31:10Z,individual,,neither agree nor disagree,,,,,"fuck capitalism\n\neat the rich",Yes,
QYQzTSL6Z7YeF7g6p,md3cRHQfF5jZD4ATk,xTX5xzEvtebxqa9Sd,2024-04-22T16:31:48Z,,,,39,woman,shitty,"absolutely not\nfuck capitalism\neat the rich",,,bachelor
JiJEGezRwBLieZEuC,fP5Ar5WEBsbPPQnng,acHhadMz66YFXwEeq,2024-04-22T16:47:17Z,team,true,strongly disagree,,,,,Typing???? What a joke.,No,
CY9EkeKaXiTCSMBKP,fP5Ar5WEBsbPPQnng,acHhadMz66YFXwEeq,2024-04-22T16:47:54Z,,,,75,Male,Poor. I am not a good typist. ,No,,,bachelor
EHQ2efZiQwLWbJWxM,F4XHDrrMiZP7o2rg2,7qyFs2r8rRgEAWHHP,2024-04-22T17:05:35Z,individual,true,neither agree nor disagree,,,,,,Yes,
rijsLsWohBQMmDFj2,F4XHDrrMiZP7o2rg2,7qyFs2r8rRgEAWHHP,2024-04-22T17:05:55Z,,,,40,male,,,,,high-school
u5WNSML29PwrYGrNN,xKC4s9fGDQbmrikk6,LeffsG9HjTzzicSkT,2024-04-22T17:27:46Z,individual,false,strongly disagree,,,,,,No,
Wh4htkzhZgtJN9xpi,cxaipHyBqnzQtCvLi,LeffsG9HjTzzicSkT,2024-04-22T17:28:06Z,individual,false,disagree,,,,,no,No,
qXtqqmR3kSgjQP8tZ,PLiHA8DbNDe5FrSfZ,LeffsG9HjTzzicSkT,2024-04-22T17:28:06Z,team,true,strongly agree,,,,,None.,Yes,
CBpMFHh4GWvAY8ZFJ,WFi5gGQTocaGkqiBo,LeffsG9HjTzzicSkT,2024-04-22T17:28:07Z,team,false,agree,,,,,Some of the challenges were very collaborative and difficult to manage without communication. ,Yes,
HkFWLhembxArPJKNo,uhL7voQW7WJpknGTA,LeffsG9HjTzzicSkT,2024-04-22T17:28:14Z,individual,true,disagree,,,,,The anagram thing kept changing and being unresponsive,Yes,
7whcHRidv7LhWC88u,xKC4s9fGDQbmrikk6,LeffsG9HjTzzicSkT,2024-04-22T17:28:27Z,,,,45,female,stand back and let others screw up,no,,,master
wPtjKRt54dyLsj4kk,8gHeB5rfytHxWeP9u,LeffsG9HjTzzicSkT,2024-04-22T17:28:43Z,team,true,strongly agree,,,,,"The unscramble game lagged a bit. Wish time running out would submit, can't force teammate to agree.",Yes,
sdtJZz8ct5EWPqe4b,uhL7voQW7WJpknGTA,LeffsG9HjTzzicSkT,2024-04-22T17:29:04Z,,,,39,male,Not getting in other people's way.,Yes,,,bachelor
sQN77yGKwGfW35BHq,WFi5gGQTocaGkqiBo,LeffsG9HjTzzicSkT,2024-04-22T17:29:08Z,,,,36,Male,"I was able to type quickly and find hidden words, but struggle with the mathematical puzzles. ","Overall, but I would've appreciated something about the point values to $. ",,,master
nAtRxAsE7TBA8KfLe,cxaipHyBqnzQtCvLi,LeffsG9HjTzzicSkT,2024-04-22T17:29:10Z,,,,45,female,determination,no it should have been more for the effort and time put in on it,,,high-school
4bvtFEEcXDAEHZaYY,PLiHA8DbNDe5FrSfZ,LeffsG9HjTzzicSkT,2024-04-22T17:29:16Z,,,,46,Female,Good at working with others and contributing. ,"Yes, thank you.",,,high-school
imWKLDRTTMzcu9hak,jAx23nipH4mY8Razc,54peqJv6HPir4Jo7k,2024-04-22T17:30:36Z,individual,true,agree,,,,,,Yes,
F6zGDzw7psrn93oHj,jAx23nipH4mY8Razc,54peqJv6HPir4Jo7k,2024-04-22T17:30:49Z,,,,32,Female,Average,Yes,,,master
oGmLMn6dyDyWyY7QT,vEBFzvHryNMt35PJG,54peqJv6HPir4Jo7k,2024-04-22T17:31:15Z,individual,true,strongly agree,,,,,"Everything seemed to work fine, from start to finish.",Yes,
cePPMpLud6W5TQMHf,8gHeB5rfytHxWeP9u,LeffsG9HjTzzicSkT,2024-04-22T17:32:13Z,,,,46,male,picking one part of the job to do,"No. Mainly because I can't force teammates to accept. One guy wouldn't hit accept, nor tell us what was wrong. Wage was lower than last time and it was low then. Even if I get the entire later bonus it is like half of what I expected.",,,high-school
Qe22DKfDie6jJkoTh,vEBFzvHryNMt35PJG,54peqJv6HPir4Jo7k,2024-04-22T17:32:50Z,,,,60,male,"I did ok in the typing, and match the dots motion, but not ok in the anagrams and logic puzzles.","Yes, I feel that the amount paid is fair for the tasks that we did.",,,bachelor
hk_e1d04703ccb8a9ca,LwLrY3zoW3sF8ofQR,mnaauEJYPpweuJEXk,2024-04-22T17:33:39Z,individual,false,agree,,,,,,Yes,
5yptd6wTADBJnJa4T,LwLrY3zoW3sF8ofQR,mnaauEJYPpweuJEXk,2024-04-22T17:34:21Z,,,,39,Female,average,yes,,,bachelor
WpMgLurrPJobjEiSy,3Y2F4fie9SX4AQJbS,mnaauEJYPpweuJEXk,2024-04-22T17:34:53Z,team,true,agree,,,,,more games should add,Yes,
eFhqAEeZZ2hncS8kC,3Y2F4fie9SX4AQJbS,mnaauEJYPpweuJEXk,2024-04-22T17:35:35Z,,,,41,male,average,yes,,,bachelor
yzmzbCtX8rxGoo9fY,B9HbFuFoZh54Csb8s,7qyFs2r8rRgEAWHHP,2024-04-22T17:36:51Z,individual,true,neither agree nor disagree,,,,,Too much conflict in updating,Yes,
TY4HjzabeeHh5dRzD,zAd9ufBh5cEnAWrJd,7qyFs2r8rRgEAWHHP,2024-04-22T17:36:52Z,team,true,agree,,,,,"none, pretty quick to get started",Yes,
hk_f609d34da88ca107,uiuTBXJAvxEd8WSR3,7qyFs2r8rRgEAWHHP,2024-04-22T17:36:53Z,team,true,neither agree nor disagree,,,,,Difficult to navigate text field with multiple users. Frustration over puzzle game with others.,Yes,
t8aSyReymW7eBmZK3,6X6DERFaH2a6R3Pkk,7qyFs2r8rRgEAWHHP,2024-04-22T17:36:54Z,team,false,agree,,,,,none,Yes,
KMEHtXwE3JEvMmikd,2qHNnkwDSogo9A7dw,7qyFs2r8rRgEAWHHP,2024-04-22T17:37:04Z,team,true,strongly agree,,,,,"I enjoyed this game, it was tough but fun.",Yes,
jQN96x9c7SuiczTGz,B9HbFuFoZh54Csb8s,7qyFs2r8rRgEAWHHP,2024-04-22T17:37:19Z,,,,68,male,word scramble,not enough,,,master
7ouhhKLhwuQZidqba,4sWn53ABtptQ93sYP,8rZjeHJy3dwjZketq,2024-04-22T17:37:19Z,team,true,agree,,,,,,Yes,
iZBmFPFfQ9AzzihT5,yix6jTRGTo38EAdjX,8rZjeHJy3dwjZketq,2024-04-22T17:37:26Z,team,true,strongly agree,,,,,It was pretty fun!,Yes,
snA6ijm2J3yG356mJ,zAd9ufBh5cEnAWrJd,7qyFs2r8rRgEAWHHP,2024-04-22T17:37:27Z,,,,66,female,I was good at typing and accuracy. The logic puzzle is not my strong suit.,Not sure what I earned so can't answer.,,,master
zayuLviSEs8fCCtuX,uiuTBXJAvxEd8WSR3,7qyFs2r8rRgEAWHHP,2024-04-22T17:37:32Z,,,,33,Male,I tried to propose solutions and did well on anagrams. I would have liked to logic out the puzzles more.,Yes.,,,bachelor
GvLJqjcTEj3gYMnKp,2qHNnkwDSogo9A7dw,7qyFs2r8rRgEAWHHP,2024-04-22T17:37:34Z,,,,50,Female,Average,Yes,,,bachelor
WabDwJXxgwt3MGqNo,6X6DERFaH2a6R3Pkk,7qyFs2r8rRgEAWHHP,2024-04-22T17:37:41Z,,,,50,female,"I do not know, I guess patience.",No,,,high-school
MKA2X6887PSNWfPze,yix6jTRGTo38EAdjX,8rZjeHJy3dwjZketq,2024-04-22T17:37:57Z,,,,24,Female,Pretty good,yes,,,bachelor
wvn55kjyJX9nXtXg3,4sWn53ABtptQ93sYP,8rZjeHJy3dwjZketq,2024-04-22T17:38:51Z,,,,37,Female,"Weak in round 4 puzzle and 5 estimating direction. Typing, unscrambling, and list words heard was better.",Yes.,,,bachelor
7ewqonsneqooYdHgi,enaHSxY28XLKd67pj,acHhadMz66YFXwEeq,2024-04-22T17:40:17Z,team,true,strongly agree,,,,,I enjoyed it thanks!,Yes,
QpBDS6y6E59eJCxbq,bmeKNnFXccTNRMXfq,acHhadMz66YFXwEeq,2024-04-22T17:40:18Z,team,true,agree,,,,,,Yes,
pykmTFatFBiHTNdMY,ucdXmvLdnqowQfMTX,acHhadMz66YFXwEeq,2024-04-22T17:40:31Z,team,true,strongly agree,,,,,"It was very intuitive, user friendly and well explained.",Yes,
xydB2CRT69EK7Jv5a,hk_1201e3f7a5dc4c7d,acHhadMz66YFXwEeq,2024-04-22T17:40:39Z,team,true,agree,,,,,n/a,Yes,
5ppd6axY7zf7HED3Q,bmeKNnFXccTNRMXfq,acHhadMz66YFXwEeq,2024-04-22T17:40:49Z,,,,55,Female,,,,,bachelor
9oKeFDzt3CK56NpiS,enaHSxY28XLKd67pj,acHhadMz66YFXwEeq,2024-04-22T17:41:06Z,,,,49,Male,I spotted errors and spoke up when I thought something needed to be changed.,"I think so, thank you,",,,bachelor
Kiu59XNe9RuhdmW8W,ucdXmvLdnqowQfMTX,acHhadMz66YFXwEeq,2024-04-22T17:41:10Z,,,,32,Female,I was good at fixing errors.,"Yes, thank you!",,,bachelor
RofXmvSGSJf8aa6FT,hk_1201e3f7a5dc4c7d,acHhadMz66YFXwEeq,2024-04-22T17:42:36Z,,,,53,Male,My strength is my general knowledge. ,It think the pay is somewhat fair. ,,,master
6yPYN7FDaQdJc7Q5i,M8yLC8voESyaz5v8a,acHhadMz66YFXwEeq,2024-04-22T17:43:34Z,team,false,agree,,,,,I enjoyed the game. I sorta got confused on the second to last game.,Yes,
RAXnkLJzreRzQGGTN,M8yLC8voESyaz5v8a,acHhadMz66YFXwEeq,2024-04-22T17:43:58Z,,,,35,female,I was a medium player. I participated when I felt confident.,Yes,,,master
eHpFi9HTD9xvrafM3,quLPTLFLkR6jXtnwp,NWGXm55eNWYfJELCz,2024-04-22T18:39:13Z,individual,true,strongly disagree,,,,,"Honestly, doesn't make much sense",No,
FAAWywDt7bNXL7DTG,quLPTLFLkR6jXtnwp,NWGXm55eNWYfJELCz,2024-04-22T18:40:30Z,,,,78,male,"None, I'm a two finger typist","Yes, crazy for everyone",,,high-school
3BRWhXmCLuSjqGTi9,X8MESSJp5Rhfv86uo,fZbiPZfQ3oHRiA92c,2024-04-22T18:52:20Z,individual,,agree,,,,,,Yes,
yvqJFZL59Nv52hhrN,X8MESSJp5Rhfv86uo,fZbiPZfQ3oHRiA92c,2024-04-22T18:53:00Z,,,,60,Female,Middle-ish,Yes,,,high-school
hL9u6TNWfo5q5KzB2,BowGni2dnKQbnokk2,5cbm6fMGBhkLLEenu,2024-04-22T18:57:51Z,individual,,agree,,,,,"I had no issues other than not knowing if I needed to enter two shift enters when typing during that task. Also, this text box can't change size so it is a bit of a hassle writing this.",Yes,
P8N2MsKJCdQ8Ctn8o,BowGni2dnKQbnokk2,5cbm6fMGBhkLLEenu,2024-04-22T18:59:21Z,,,,48,male,I'm not sure. I like doing these types of tasks/puzzles/games.,I think so.,,,bachelor
DFMgD7LsvZxtExg9t,jBZtarbXvPn5L7DhD,MQxZcWvgv8yY6RQyo,2024-04-22T19:03:37Z,team,true,agree,,,,,,Yes,
G8XieYGufdj7tcJt5,BoiZJRj3dzTkX7rn8,MQxZcWvgv8yY6RQyo,2024-04-22T19:03:43Z,individual,true,strongly agree,,,,,,Yes,
kmtQh33uceRY4GdwS,dqrgx56BdK4stq6wn,MQxZcWvgv8yY6RQyo,2024-04-22T19:03:44Z,team,true,strongly agree,,,,,Very cool experiments,Yes,
Lt4N6D4kA6TqgAxyL,oR4ypAX6F9cjBG7tT,MQxZcWvgv8yY6RQyo,2024-04-22T19:04:02Z,team,false,agree,,,,,Would like it better if I had a HIT to submit on Mturk. Would feel more secure about payment.,,
sLWXPuZ5kpDwpuJoa,6NJGX6Ac6Sdc9u8zp,MQxZcWvgv8yY6RQyo,2024-04-22T19:04:03Z,team,true,strongly agree,,,,,No,Yes,
WgwxwuXmRkR6F8n7x,xHQiw5BA3KZyopk86,MQxZcWvgv8yY6RQyo,2024-04-22T19:04:04Z,team,true,strongly agree,,,,,The notification was right before the game start,Yes,
WXydMtySsZH8qkp7i,jBZtarbXvPn5L7DhD,MQxZcWvgv8yY6RQyo,2024-04-22T19:04:05Z,,,,24,female,Word scramble and audio task,"No, a bit low. ",,,bachelor
3nhNcBmNSSNbmDdX7,dqrgx56BdK4stq6wn,MQxZcWvgv8yY6RQyo,2024-04-22T19:04:12Z,,,,24,Male,"I guess it was ok, but not thaat good",Yes,,,master
YuhTqhWAuPogKMnF5,6NJGX6Ac6Sdc9u8zp,MQxZcWvgv8yY6RQyo,2024-04-22T19:04:29Z,,,,41,Female,alright,no,,,other
awc84j2cTXFWXvwZt,BoiZJRj3dzTkX7rn8,MQxZcWvgv8yY6RQyo,2024-04-22T19:04:32Z,,,,70,female,so so,ok,,,bachelor
tGNRdQy2KWuu9Epub,oR4ypAX6F9cjBG7tT,MQxZcWvgv8yY6RQyo,2024-04-22T19:04:52Z,,,,34,Male,Communicating,It was mediocre. could have been more for the amount of time spent.,,,high-school
Q49itXktmDHfCpP5N,xHQiw5BA3KZyopk86,MQxZcWvgv8yY6RQyo,2024-04-22T19:05:01Z,,,,48,female,"We attempted to divide the tasks among ourselves, with each person handling a portion, and occasionally discussing potential outcomes.",Yes,,,bachelor
Fy5TwMDwchDJABNek,doeTyq3jMmae4n3XE,jYiAoyGy3j3nFwbmQ,2024-04-22T19:07:53Z,individual,false,neither agree nor disagree,,,,,,No,
8Kvk6ribNyDwTLodv,JcvARDDsHnHRBhBSb,jYiAoyGy3j3nFwbmQ,2024-04-22T19:08:00Z,individual,true,strongly agree,,,,,no,Yes,
H4dPt5mZjXxK2BD6R,JcvARDDsHnHRBhBSb,jYiAoyGy3j3nFwbmQ,2024-04-22T19:08:25Z,,,,52,male,teamwork,yes,,,master
KEaZDWJ2dPBrCjz8k,doeTyq3jMmae4n3XE,jYiAoyGy3j3nFwbmQ,2024-04-22T19:08:37Z,,,,50,male,My willingness to go along with the group's determinations,yes,,,high-school
sCggBDZtBgrayYX2X,8bx7nosNLSWqFT9hq,R6oquHYP2eTfn97cv,2024-04-22T19:11:03Z,individual,,strongly agree,,,,,The games were a lot of fun. thank you.,Yes,
aesMFYYwfhWHT4Q2F,8bx7nosNLSWqFT9hq,R6oquHYP2eTfn97cv,2024-04-22T19:12:03Z,,,,46,female,I think I was pretty good at typing. ,"yes, very fair. thank you.",,,high-school
gXS6eW3SWknYsgJTS,RyJ3Lpc3QyZzuXCZB,SaygskpSjccSYvhZC,2024-04-22T19:15:44Z,individual,,agree,,,,,None,Yes,
