_id,playerId,gameId,createdAt,data.synergyPreference,data.teamViability,data.enjoyedTask,data.age,data.gender,data.strengthInGame,data.payFair,data.feedbackOpenEnded,data.feedbackMultipleChoice,data.education
6xBkNrLLimsSnJFXY,RyJ3Lpc3QyZzuXCZB,SaygskpSjccSYvhZC,2024-04-22T19:16:26Z,,,,55,Female,Average,Yes,,,bachelor
ciiueb9xCh43xTqm6,otfsZb7RdqRGrHN95,sm6HMALyoW3bJpXEP,2024-04-22T19:20:49Z,team,false,agree,,,,,,Yes,
pvFcugTAWBbXmM8Kr,Wc6e3j9Q9hKz4crPv,sm6HMALyoW3bJpXEP,2024-04-22T19:21:08Z,team,true,agree,,,,,some of the wait times were too long,Yes,
4YEefn3biSn39ZEsA,QJ6CM8bwZE6WAmNsw,sm6HMALyoW3bJpXEP,2024-04-22T19:21:40Z,individual,false,strongly agree,,,,,It is very interesting task ,Yes,
JRkMFnWSf6b5PQgGh,Wc6e3j9Q9hKz4crPv,sm6HMALyoW3bJpXEP,2024-04-22T19:21:42Z,,,,63,male,average,depends on how much bonus I get :-),,,master
QbDaMtATpZE6fBGhd,otfsZb7RdqRGrHN95,sm6HMALyoW3bJpXEP,2024-04-22T19:21:59Z,,,,43,male,I did better on the word games and felt the logic puzzle was difficult.,It was too low for how long this task was. Longer tasks like this should pay more.,,,bachelor
uN2PjD44krGkjyjHA,oNDba4Afn8xQBNaQj,NWGXm55eNWYfJELCz,2024-04-22T19:22:33Z,individual,false,agree,,,,,"if people left, does it affect our score?",Yes,
FpoCkJDfTfbCSqEKc,QJ6CM8bwZE6WAmNsw,sm6HMALyoW3bJpXEP,2024-04-22T19:22:45Z,,,,32,Male,It will mind relax game,Nothing,,,bachelor
4f2jAxCE2ZKqkxyuP,yZSes4tCCfr7rGQzG,NWGXm55eNWYfJELCz,2024-04-22T19:22:51Z,team,true,strongly agree,,,,,too short a time to respond via email,Yes,
3w386nGkEksB2Euh6,WQB94SfagLTDMAbDg,NWGXm55eNWYfJELCz,2024-04-22T19:22:53Z,team,true,strongly agree,,,,,"None, very enjoyable.",Yes,
6BePkoJLfwCkkfqAz,uh7rF9vFcXz4uvGGe,NWGXm55eNWYfJELCz,2024-04-22T19:23:04Z,individual,true,agree,,,,,It was hard to work cooperatively,Yes,
shMQh8gW2rsFL565J,8mo7w4wrr86hpK2u8,NWGXm55eNWYfJELCz,2024-04-22T19:23:05Z,individual,false,strongly disagree,,,,,People on my team left during the experiment. Which in turn hurt the team.  ,No,
EweqdQAXdFTg27kg9,oNDba4Afn8xQBNaQj,NWGXm55eNWYfJELCz,2024-04-22T19:23:20Z,,,,28,female,keeping everyone's mood up!,Yes but a bit more would be good.,,,master
v4b3nNsvAGeZzxqxE,yZSes4tCCfr7rGQzG,NWGXm55eNWYfJELCz,2024-04-22T19:23:23Z,,,,36,female,"good in some, bad in others",yes very,,,bachelor
9tdYSCbMrBY499MQq,uh7rF9vFcXz4uvGGe,NWGXm55eNWYfJELCz,2024-04-22T19:23:37Z,,,,64,male,perseverance,yes,,,bachelor
4vKrxjChkrbAzSNS9,KeAMDKcG7mD25S9Tk,cy7Qiyo7cTrh5HJpt,2024-04-22T19:23:45Z,individual,true,strongly agree,,,,,Waiting room was quick,Yes,
dhQu8JogR65k7JDHv,rjXZD5zAj7BAxdSdN,cy7Qiyo7cTrh5HJpt,2024-04-22T19:23:48Z,team,true,strongly agree,,,,,,Yes,
XCunDSQJuWdSA4psr,HE9qhX4FTM9n4gdyK,cy7Qiyo7cTrh5HJpt,2024-04-22T19:23:54Z,team,true,strongly agree,,,,,Really fun and the interation was amazing,Yes,
g7cZDPwXz3xzd4Esp,8mo7w4wrr86hpK2u8,NWGXm55eNWYfJELCz,2024-04-22T19:23:59Z,,,,40,Male,I am very good at puzzles,I am not sure what the final pay is. It is not clear to me.,,,bachelor
Dbe3Dgp3b3rj4b95t,rjXZD5zAj7BAxdSdN,cy7Qiyo7cTrh5HJpt,2024-04-22T19:24:09Z,,,,,,low,yes,,,high-school
noZW9rGL5bDMZDkZM,aWYdLjZxusNT2G4KB,cy7Qiyo7cTrh5HJpt,2024-04-22T19:24:10Z,team,true,agree,,,,,It was hard!,Yes,
tY9ucTRJPbxYFawGQ,G3mx35ToFWEMBNQsd,cy7Qiyo7cTrh5HJpt,2024-04-22T19:24:21Z,team,true,strongly agree,,,,,very fun. I think the no typing before words on the audio one was a bit premature and caught many of us that were killing time in chat. There should be a warning not to type again before that one.,Yes,
THxReaRbpFimn4Aqb,aWYdLjZxusNT2G4KB,cy7Qiyo7cTrh5HJpt,2024-04-22T19:24:26Z,,,,46,female,so/so,yes,,,master
3J3Ch3TwNeWztDduE,KeAMDKcG7mD25S9Tk,cy7Qiyo7cTrh5HJpt,2024-04-22T19:24:32Z,,,,60,Female,I thought I was a take charge and communicated with my team.,Yes the pay was very fair,,,bachelor
TvfERESrJmwbMHCRL,WQB94SfagLTDMAbDg,NWGXm55eNWYfJELCz,2024-04-22T19:24:35Z,,,,52,female,Average to fair; did my best to contribute to the best of my ability.,"Yes, curious about the payout.",,,high-school
nLTWphmcBqimeMWgg,HE9qhX4FTM9n4gdyK,cy7Qiyo7cTrh5HJpt,2024-04-22T19:24:44Z,,,,27,male,I loved to play with teammates,Yes,,,master
LaRwTDy8yhvcWcEmx,G3mx35ToFWEMBNQsd,cy7Qiyo7cTrh5HJpt,2024-04-22T19:25:42Z,,,,30,female,slightly above average,I was hoping for higher (at least $10) since I gave up working DoorDash/UberEast for this and would have made at least that probably during the lunch rush even if it were slow...,,,master
mT6KgfoELwByp3FdD,qaW8YihkZ8DYZfLnf,yWNJtcxZXQZ86PMkd,2024-04-22T19:28:50Z,team,true,agree,,,,,Nothing to add at this time.,Yes,
FxtMfCqmbsfjbbnoW,JoSyqa3hjrEHEyu27,yWNJtcxZXQZ86PMkd,2024-04-22T19:29:23Z,team,true,strongly agree,,,,,Interesting activity. Enjoyed it.,Yes,
FSKp6RnsrjaFRMDGN,qaW8YihkZ8DYZfLnf,yWNJtcxZXQZ86PMkd,2024-04-22T19:29:25Z,,,,50,Female,Basic,Yes,,,high-school
BAcqtpBR6iTHneKZz,pARJLxPss2xnJWmWW,yWNJtcxZXQZ86PMkd,2024-04-22T19:30:01Z,team,true,agree,,,,,It was a nice experience to work together with team mates.,Yes,
Dz7PM6dKcisAAj9eB,JoSyqa3hjrEHEyu27,yWNJtcxZXQZ86PMkd,2024-04-22T19:30:10Z,,,,30,Male,Good,Yes,,,bachelor
4GFTnmtptJX7p9CgB,pARJLxPss2xnJWmWW,yWNJtcxZXQZ86PMkd,2024-04-22T19:32:23Z,,,,48,female,"I did well, as well as my team mates.",It's okay,,,other
LTke6LdS676CFSjSk,DNr5TM7Q6MWvYwRET,QrHu4tWTF84XPe8Et,2024-04-22T20:19:33Z,individual,,neither agree nor disagree,,,,,the logic problem table was hard to use since it couldn't describe all possible relationships. The labels were also loading in the wrong place. The textbox given was too small to take notes (even after zooming out). It made it difficult to complete the logic task. More assurances that pay will come through MT despite the link being outside of it would be helpful. This textbox is not wide enough.,Yes,
ENN7bCd7xDPuDXweS,DNr5TM7Q6MWvYwRET,QrHu4tWTF84XPe8Et,2024-04-22T20:23:33Z,,,,37,Female,"Medium low. Some of the games required more focus than I could muster at the moment, especially since I was having difficulty with my keyboard/mouse and the interface loading.","I'm going to guess that it's erring on the side of low paying considering effort required, time needed, and overall riskiness of this interface causing lack of trust. The task creator seems like they are trying to communicate well, but they should be shooting for a higher min per hour payment over $12.",,,bachelor
HadTmXrXxEcauB2Kb,W5jqaTmWouKT4mThY,FoZE6dFD5B9NEk2Yi,2024-04-22T20:27:13Z,individual,,disagree,,,,,word problems not fun,No,
zhkKBu7F96TYL6GKm,W5jqaTmWouKT4mThY,FoZE6dFD5B9NEk2Yi,2024-04-22T20:28:38Z,,,,50,female,the writing,yes,,,
NL9iGPgnJTMojuFjd,Qezost8BWiabmMFEt,2no6KFpEq8N7RuZFw,2024-04-22T20:37:46Z,team,true,neither agree nor disagree,,,,,,Yes,
HaSMXxxGXMvFa7Hyp,D46CsytNxP4HZFdLj,2no6KFpEq8N7RuZFw,2024-04-22T20:37:56Z,individual,true,strongly agree,,,,,it was very funa and amusing.,Yes,
DXwPLYJduCMD7foeC,p35P5AP2vBGxMcCTq,2no6KFpEq8N7RuZFw,2024-04-22T20:38:15Z,individual,false,strongly disagree,,,,,Let us know the bonus as we go. I don't think this was worth the time.,No,
s5DELuQXoR3fE6bzc,D46CsytNxP4HZFdLj,2no6KFpEq8N7RuZFw,2024-04-22T20:38:19Z,,,,45,male,"I was decent at some aspects, when it came to unscrambling.",yes.,,,bachelor
G5yRn2zj84Yqq9rBM,Qezost8BWiabmMFEt,2no6KFpEq8N7RuZFw,2024-04-22T20:38:25Z,,,,65,female,Strong on some not on others,yes,,,high-school
LfyGws59cFmK5h3jR,xK2X9fiAwfoGN6J96,2no6KFpEq8N7RuZFw,2024-04-22T20:38:25Z,team,true,strongly agree,,,,,"The game with the 4 selections was too large to fit on my 17"" screen. I had to keep moving the screen to see what the choices were ",Yes,
p54Fx5ALCYgrg34dS,p35P5AP2vBGxMcCTq,2no6KFpEq8N7RuZFw,2024-04-22T20:39:13Z,,,,62,female,giving an answer without it being interrupted,no,,,bachelor
a6vzrTspyLwFXuRiA,xK2X9fiAwfoGN6J96,2no6KFpEq8N7RuZFw,2024-04-22T20:39:21Z,,,,72,female,average or a bit higher,I think the pay was very fair. I would have played no matter what the pay was. Your games are always fun and I'm glad when I'm able to participate. ,,,bachelor
5ERAzeysueTtCRjnK,8NQecuYJFiC7TmAYc,8zGzAG68dtPujD8RT,2024-04-22T20:39:22Z,team,true,strongly agree,,,,,,Yes,
gaHx6gcSZ2QWBW8Ng,C34P8yHnxE87H6X6g,8zGzAG68dtPujD8RT,2024-04-22T20:39:39Z,individual,false,agree,,,,,I wish the time for the audio words could have been shorter,Yes,
oA7ML2nTDaWPj8bto,C34P8yHnxE87H6X6g,8zGzAG68dtPujD8RT,2024-04-22T20:39:55Z,,,,60,Female,Strong,yes,,,bachelor
TLWwfiLTeBdFbPTMA,8NQecuYJFiC7TmAYc,8zGzAG68dtPujD8RT,2024-04-22T20:40:13Z,,,,33,Female,I think i did okay. Wasnt the strongest on the team or fairest.,Yes,,,bachelor
XAfu7CaNh7mHS2raN,kejqGCy73oySp5mgr,d4YKJMFJScJwxzCSW,2024-04-22T20:40:50Z,individual,true,strongly agree,,,,,"It ran good, I had no technical issues.",Yes,
c2EKHvzf8X9bsFf6H,KQfxx5iG854DEPpDi,d4YKJMFJScJwxzCSW,2024-04-22T20:41:00Z,team,true,agree,,,,,audio files should be consistent across participatns,Yes,
jcpwN7GpPHzMocFSg,gheatoqrS46D3aHwP,d4YKJMFJScJwxzCSW,2024-04-22T20:41:26Z,team,true,neither agree nor disagree,,,,,I wish I could have a bit more time on harder games such as the puzzles,Yes,
hCPgqt32y6mobFQwt,hEfCZkNN2LsqB9otB,8zGzAG68dtPujD8RT,2024-04-22T20:41:57Z,team,true,neither agree nor disagree,,,,,no,Yes,
hjCP6oPAuqRYqZ69u,BuSSTRNaKxWFFmNyP,M9jsePArmKxGFutGa,2024-04-22T20:42:50Z,team,true,strongly agree,,,,,this was really fun!,Yes,
9CW5sRaxmbGewYqFb,kejqGCy73oySp5mgr,d4YKJMFJScJwxzCSW,2024-04-22T20:42:56Z,,,,42,male,I would say I was the middle of the pack. Corgi was the strongest player and Bee the weakest.,"It looks like 7.50$ is what I'll be getting from what it says up there? So no, $7.50 is not an appropriate hourly rate at all. I could be wrong though, I don't really know what I'll be getting paid in total, anything above 12$ would be good for an hourly rate.",,,high-school
NCyHBXen3tPDECYN2,coqDP6txWH4BPPSMx,M9jsePArmKxGFutGa,2024-04-22T20:42:57Z,individual,true,agree,,,,,Not particularly.  ,Yes,
SZBqnjqRfkfwCuiEg,NTiFDL5Jc82hwD3DH,M9jsePArmKxGFutGa,2024-04-22T20:43:11Z,team,true,strongly agree,,,,,"Notifications were timely, the waiting room was fine, and the experience was superlative.",Yes,
XHoFMRquMeZHKgxEp,M6MMgQwGcbcoeZxRB,M9jsePArmKxGFutGa,2024-04-22T20:43:23Z,team,true,agree,,,,,I had only 5 minutes notification. At least 10 minutes would be nice.,Yes,
ffgCjkfCRh35KegsP,BuSSTRNaKxWFFmNyP,M9jsePArmKxGFutGa,2024-04-22T20:43:35Z,,,,48,Female,definitely the word scramble,yes it didn't even feel like work,,,high-school
De4fei7SDtWCD3x6L,gheatoqrS46D3aHwP,d4YKJMFJScJwxzCSW,2024-04-22T20:43:41Z,,,,32,Female,My strength is simple questions like unscramble words and adjusting the arrow game,I feel the pay was mostly fair because everyone on the team tried to help,,,master
9rQHbxhHWj8BXBNKQ,uQro3z5bSSmkF6cQ4,M9jsePArmKxGFutGa,2024-04-22T20:44:00Z,team,true,strongly agree,,,,,"The gameplay and the chat was engaging, and we all tried to help the team. Some tasks were easier than others, and some team members were better at different tasks.",Yes,
EcJ7KtKNzau7JqK7P,RoRSeDrDXoQKWrDoD,M9jsePArmKxGFutGa,2024-04-22T20:44:28Z,team,false,strongly agree,,,,,Great experience but not good at a couple of the games. Very good teammates.,Yes,
yub4bYH2ewEZvdPhE,NTiFDL5Jc82hwD3DH,M9jsePArmKxGFutGa,2024-04-22T20:44:47Z,,,,46,male,The words scramble and remembering words.,"Yes, though we were confused on if the last word should be included in the list of remembered words. It was also unclear about how we should proceed in the the paragraph typing exercise (unless that was part of the idea).",,,master
J43ANga5wCg59n75R,M6MMgQwGcbcoeZxRB,M9jsePArmKxGFutGa,2024-04-22T20:44:49Z,,,,30,Female,I would say average strength. Some areas were more difficult while others I excel at.,"Extremely fair, as all participated in the chat and expressed opinions.",,,high-school
MDrRMPD5CJ4KMxnWs,coqDP6txWH4BPPSMx,M9jsePArmKxGFutGa,2024-04-22T20:45:02Z,,,,36,Female,Typing as about the only thing I was really good at.  ,Not really.  What I will be receiving is definitely very underpaid for an hour of contribution time.  If there was some base pay as well to raise it to even closer to $10 minimum for the hour of time yes but otherwise I was pretty disappointed in my bonus amount.,,,high-school
k3GoJSctj6vuWqvC6,uQro3z5bSSmkF6cQ4,M9jsePArmKxGFutGa,2024-04-22T20:45:18Z,,,,54,male,"I was good at editing transcriptions, and remembering spoken words.","Yes, its fair.",,,other
rmiTbSmHTKewX6Fe8,KQfxx5iG854DEPpDi,d4YKJMFJScJwxzCSW,2024-04-22T20:45:26Z,,,,41,Male,"I seemed to be a good typist, and I recognized the shameful deception with the audio files early on, so I was able to help the team coordinate.","The potential bonus that I was promised up front seemed fair, but I should have known that it was totally infeasible, given the past conduct of researchers at MIT.",,,bachelor
WNQJHcgQTHSm3FHX5,hEfCZkNN2LsqB9otB,8zGzAG68dtPujD8RT,2024-04-22T20:45:36Z,,,,40,female,average,,,,bachelor
FRFNo8yHcdSB4BJZT,RoRSeDrDXoQKWrDoD,M9jsePArmKxGFutGa,2024-04-22T20:47:04Z,,,,55,Female,"I like working with words. In this game ,my biggest strength was my team.",Yes it would have been had I done better. I think it is very reasonable though.,,,high-school
5WqyxRfTXnjrMLrFL,hk_5c860a678d69be08,kwbeByePvavap33QA,2024-04-22T21:17:05Z,team,true,agree,,,,,It was fun overall.,Yes,
Wkw3QWAvcDpA3pFBp,yd4R8vDCdTcytgn2v,kwbeByePvavap33QA,2024-04-22T21:17:23Z,team,false,agree,,,,,Instant access passes to studies and games are very specific and fun.,Yes,
eqsjF7T8GbcFsgRFZ,kSRiCNPvmzmqYriyQ,kwbeByePvavap33QA,2024-04-22T21:17:38Z,team,true,strongly agree,,,,,no,Yes,
PawLKDdfHhDCkwAtC,hk_5c860a678d69be08,kwbeByePvavap33QA,2024-04-22T21:17:44Z,,,,46,Male,The word scramble was my strength.,Mainly,,,bachelor
hjnoc28QiXwZ5Z4yw,yd4R8vDCdTcytgn2v,kwbeByePvavap33QA,2024-04-22T21:17:58Z,,,,32,Male,Typing quickly,Yes!,,,high-school
ke26mk3SvkRj4REBL,kSRiCNPvmzmqYriyQ,kwbeByePvavap33QA,2024-04-22T21:18:36Z,,,,61,Female,easy,yes,,,bachelor
TDQbqMZiNqwPtpW4j,qh6sR6mrHKELzcF5k,3je9eF333X9qPfNty,2024-04-23T14:17:27Z,individual,,strongly agree,,,,,,Yes,
3yCrs5R9Ji3YpSH6Y,qh6sR6mrHKELzcF5k,3je9eF333X9qPfNty,2024-04-23T14:18:00Z,,,,36,male,Easier to type and follow instructions than be creative.,Sure.,,,bachelor
NgxJjeXLRb4Gkin6R,RDANcuGv3u5mnKiER,PBK5tpWN9e6gmJbaF,2024-04-23T14:25:37Z,team,,strongly agree,,,,,Interesting task. Very difficult but challenging and fun. ,Yes,
t5XkbXmGjibD5KP9F,RDANcuGv3u5mnKiER,PBK5tpWN9e6gmJbaF,2024-04-23T14:26:36Z,,,,43,Male,"I think on some of the games I did OK, and others not so well. I think I did about average. ","Sure. I got to exercise my mind, play and earn some money. ",,,bachelor
fqMt9xfoWSmhP9GPs,fZqawkAchHwzzBXMx,hi4rhiLfx89uMWw29,2024-04-23T14:45:55Z,team,true,agree,,,,,,Yes,
54vEya5eisuK6PizB,mfLfG4M3Evw72wsDu,hi4rhiLfx89uMWw29,2024-04-23T14:46:34Z,team,false,strongly agree,,,,,awesom,Yes,
oLX6o3PgmHuJireGF,SQczBvHB5MvKmGBkt,hi4rhiLfx89uMWw29,2024-04-23T14:46:43Z,team,true,strongly agree,,,,,IT WAS A GREAT EXPERIENCE! tHE WAITING ROOM WAS TIMED VERY WELL!,Yes,
ea656LmQMLacxF5g9,gfE63tw74XzokiTBv,PvxRhgr7FtDjbupTB,2024-04-23T14:46:46Z,team,true,disagree,,,,,NO,No,
E3v7D5Eu75QG85db7,Lpfzuyn7v2BqBMnok,PvxRhgr7FtDjbupTB,2024-04-23T14:46:49Z,individual,false,disagree,,,,,stressful lol...,No,
4AvxpFhMpPhkRJZoF,zN8HauNWQ6K7DdM9h,PvxRhgr7FtDjbupTB,2024-04-23T14:47:00Z,team,true,disagree,,,,,,No,
o8wSsxHt9M8hGYGCv,iigurrtbj2of8bjkn,PvxRhgr7FtDjbupTB,2024-04-23T14:47:02Z,team,false,agree,,,,,FUN,Yes,
KiBMxKMEJFfBKXAT7,iigurrtbj2of8bjkn,PvxRhgr7FtDjbupTB,2024-04-23T14:47:03Z,,,,,,,,,,
yoCGi95AfZfM2YNR6,8PZQS5JH5BMBPeF7C,PvxRhgr7FtDjbupTB,2024-04-23T14:47:04Z,team,false,strongly agree,,,,,It was fine. ,Yes,
fLWEn9Y9z2MATNETb,mfLfG4M3Evw72wsDu,hi4rhiLfx89uMWw29,2024-04-23T14:47:04Z,,,,59,Male,Medium,ok,,,master
Ft8qtMvLwKoXibDH3,gfE63tw74XzokiTBv,PvxRhgr7FtDjbupTB,2024-04-23T14:47:05Z,,,,33,f,I fixed mistakes,no,,,master
K2yNAYqXBDMKb2dQb,Lpfzuyn7v2BqBMnok,PvxRhgr7FtDjbupTB,2024-04-23T14:47:13Z,,,,36,male,stayed out.. didn't add to the chaos after I felt something amiss.,Not sure what I'm going to get. We'll see.,,,bachelor
qpP4nSF36BeNujZtJ,fZqawkAchHwzzBXMx,hi4rhiLfx89uMWw29,2024-04-23T14:47:15Z,,,,60,male,i was pretty average,yes,,,high-school
Phe6MFsz69sbzcoAn,wdwkg85WKk6mtoJtn,PvxRhgr7FtDjbupTB,2024-04-23T14:47:17Z,team,true,strongly agree,,,,,Everything is good!,Yes,
CRNLJBhjZa2Ma6Kcy,SQczBvHB5MvKmGBkt,hi4rhiLfx89uMWw29,2024-04-23T14:48:10Z,,,,53,FEMALE,WE ALL WERE EQUAL PLAYERS AND CONTRIBUTED FAIRLY.,YES. THANK YOU SO MUCH!,,,bachelor
Px93G8YYgSA7dukzK,8PZQS5JH5BMBPeF7C,PvxRhgr7FtDjbupTB,2024-04-23T14:48:11Z,,,,59,female,I used the chat box. ,It was fair. ,,,other
EBGztbhGx4ZHd5ebd,zN8HauNWQ6K7DdM9h,PvxRhgr7FtDjbupTB,2024-04-23T14:48:22Z,,,,38,Male,I was the fastest typer but five players all working on the same task without much coordination was too much.,I think we did poorly.,,,high-school
jMT4FEmCdPk4zS2P5,wdwkg85WKk6mtoJtn,PvxRhgr7FtDjbupTB,2024-04-23T14:48:47Z,,,,24,Male,I try my best to help the team.,I think yes,,,bachelor
qRsgAgmvHxpPsbgF5,mFQycYNpCQ82YwYK9,ZXTm6bs7EMQcviDkf,2024-04-23T14:50:42Z,individual,false,agree,,,,,no,Yes,
rbrSRQj9yxSrLhkoD,8igh8oQgHuyAyK4pc,ZXTm6bs7EMQcviDkf,2024-04-23T14:50:47Z,individual,false,neither agree nor disagree,,,,,chatotic ,Yes,
zZYwCtrK7zCmhkQun,Ncjc8SACqKJyDu4ii,ZXTm6bs7EMQcviDkf,2024-04-23T14:51:06Z,individual,false,agree,,,,,It was fun but I wished that I had better partners. The partners made the last logic proble hard because they kept changing the answers,Yes,
xuTiLZrf9SvW7mxLW,mFQycYNpCQ82YwYK9,ZXTm6bs7EMQcviDkf,2024-04-23T14:51:31Z,,,,57,female,fair,yes,,,other
6ScTq2riMobwKPpXB,Ncjc8SACqKJyDu4ii,ZXTm6bs7EMQcviDkf,2024-04-23T14:52:10Z,,,,31,Male,I can type fast and I can think through problems,I felt like not all team members contributed an even amount of work,,,master
pF395e47DRnAjnAvA,8igh8oQgHuyAyK4pc,ZXTm6bs7EMQcviDkf,2024-04-23T14:52:26Z,,,,52,male,ok ,a tad low but ehh! I didn't have to put pants on (JK). ,,,high-school
itWsj32hkt5YCDvej,hk_d4fcf253c950bd12,weGRcNbBpsyo5pkWX,2024-04-23T15:13:40Z,individual,,agree,,,,,,Yes,
8oZ5znzvhX2SRPX2b,hk_d4fcf253c950bd12,weGRcNbBpsyo5pkWX,2024-04-23T15:14:18Z,,,,76,female,weak,yes,,,bachelor
2k2pFNtbsGJYcZdaq,F54QY9FCfJdgyFaZp,YxAyMXtwqqTZ6KAD5,2024-04-23T15:41:58Z,individual,,agree,,,,,no,Yes,
tr2jiNqdeBzoEjA57,F54QY9FCfJdgyFaZp,YxAyMXtwqqTZ6KAD5,2024-04-23T15:42:12Z,,,,33,Male,ok,yes,,,bachelor
vJmcLX2GkK6nbvswK,SEtGmERXxTGZtQXTL,YEpZ43gBMzTJAduTs,2024-04-23T15:45:40Z,individual,true,neither agree nor disagree,,,,,it was confusing,,
g5J3eCtBrvrxwDi3d,SEtGmERXxTGZtQXTL,YEpZ43gBMzTJAduTs,2024-04-23T15:47:04Z,,,,68,female,poor,i was to confused to know.,,,other
ip7jP6qLdq4E9efnT,w7miaed88e5twzcf5,NHoc3adz9EKkYrrnH,2024-04-23T15:57:17Z,individual,,agree,,,,,I had to refresh the waiting room because it seemed stuck and then it would proceed with the instructions and tasks.,Yes,
eiEjAorYH83iBpedu,w7miaed88e5twzcf5,NHoc3adz9EKkYrrnH,2024-04-23T15:58:10Z,,,,55,female,I have good short term recall of instructions or word lists.,I think so but I haven't found out my pay exactly yet. ,,,bachelor
jTDMpvfifhDuoqfSr,2SAbx4bhD4GKsf4qg,Y5mMRmEnwgFDYda8G,2024-04-23T16:13:37Z,individual,,strongly agree,,,,,No. I have no other feedback to share about this task.,Yes,
dgnEb3ahqRmLnMHw5,3XauEoMvdJv6N5oCk,zs6JZ6gYSzmJotPQw,2024-04-23T16:15:02Z,individual,false,disagree,,,,,,No,
Jwiw5xLivL2w3d5Eq,Xhfv4q8u89oyjqjf7,zs6JZ6gYSzmJotPQw,2024-04-23T16:15:12Z,team,true,agree,,,,,quite good but some task takes a round to get familiar,Yes,
rp7ZiYLoZaTbQwi2h,fzXgwgimywpeYy9Kv,zs6JZ6gYSzmJotPQw,2024-04-23T16:15:17Z,team,true,strongly agree,,,,,through mturk. it was really fun.,Yes,
WgQphfaTTqaM7w4P7,2SAbx4bhD4GKsf4qg,Y5mMRmEnwgFDYda8G,2024-04-23T16:15:35Z,,,,37,Male,I think that my main strengths are my ability to solve logic puzzles like word puzzles and to type relatively quickly.,Yes. I think that the pay was very fair and reasonable for this kind of task.,,,master
JT5RGqEZFRza5tFuW,fzXgwgimywpeYy9Kv,zs6JZ6gYSzmJotPQw,2024-04-23T16:16:05Z,,,,39,man,I had good strength and helped a lot.,yes,,,high-school
oi994m8xPnEKo65n5,Xhfv4q8u89oyjqjf7,zs6JZ6gYSzmJotPQw,2024-04-23T16:16:15Z,,,,33,Male,strong,ok,,,bachelor
MyyaYP7M54Mtwi8Rb,3XauEoMvdJv6N5oCk,zs6JZ6gYSzmJotPQw,2024-04-23T16:16:32Z,,,,37,Male,I think I am strong at all aspects of the game(s). I think I make a good leader.,No. The pay is about 10$ under the expectation of the time needed to complete the task. I will likely not participate in tasks by this requester moving forward.,,,bachelor
XkYDSfAq8726PPTmW,3jv8fBhZB7u94MJ79,LZE42nuj943fP47ZA,2024-04-23T16:20:14Z,individual,false,strongly agree,,,,,one player was inactive and never left. ,No,
nBnr24FroYQubBXpM,855qJJ9YPjsCZSCT2,YEpZ43gBMzTJAduTs,2024-04-23T16:20:31Z,team,true,agree,,,,,,Yes,
zKgSKZmnsGkm7ynBF,EiTnumsEXdXvbWMrH,YEpZ43gBMzTJAduTs,2024-04-23T16:20:32Z,team,true,agree,,,,,went slowly,Yes,
gQE3gKoBrc7cxbffv,veW53m7rKiR2aX7k4,YEpZ43gBMzTJAduTs,2024-04-23T16:20:34Z,individual,true,neither agree nor disagree,,,,,,Yes,
PxpzziDrzxC8QgSrF,3jv8fBhZB7u94MJ79,LZE42nuj943fP47ZA,2024-04-23T16:20:38Z,,,,32,male,typing and word scrambling. ,yes,,,master
JPEGj2vrFP4NkMTPk,F6PbtizryquitDd9g,YEpZ43gBMzTJAduTs,2024-04-23T16:20:43Z,individual,false,agree,,,,,"I have no suggestions, legitimately had fun doing it.",Yes,
PdSHvuY4YMwFh2Jpv,TJZFSNLPcQ4BeW2ud,LZE42nuj943fP47ZA,2024-04-23T16:20:49Z,individual,true,agree,,,,,"Our third player left and seemingly was never taken out of the game, causing us delays and lost points.",Yes,
JAg8KtjgGzaxfuKTH,EiTnumsEXdXvbWMrH,YEpZ43gBMzTJAduTs,2024-04-23T16:21:11Z,,,,45,male,I was good with logical tasks.,It was OK.,,,bachelor
h9vnXsivoffbFR6uW,F6PbtizryquitDd9g,YEpZ43gBMzTJAduTs,2024-04-23T16:21:11Z,,,,33,Female,I did type fast,yes,,,bachelor
YnicxJyeKH9YY3Rsi,ozkEamMcDsvjiEYjs,YEpZ43gBMzTJAduTs,2024-04-23T16:21:22Z,individual,true,agree,,,,,I did not like the writing task since i was having a hard time who was doing what ,No,
vLDGrEPgWPFmw9sAJ,veW53m7rKiR2aX7k4,YEpZ43gBMzTJAduTs,2024-04-23T16:21:57Z,,,,43,male,i was terrible at everything,no,,,bachelor
7DqYZPp8yxvn3gSaf,TJZFSNLPcQ4BeW2ud,LZE42nuj943fP47ZA,2024-04-23T16:22:10Z,,,,34,Male,"Maybe in the word unscramble. Otherwise, none.","I don't yet, as I've yet to see the bonus.",,,high-school
xLqFg5FarpitFun58,855qJJ9YPjsCZSCT2,YEpZ43gBMzTJAduTs,2024-04-23T16:22:13Z,,,,52,female,decent,play was fair but the remuneration could be more given the time investment 0f almost an hour,,,bachelor
ZRg3XmJLPDBCdaWek,ozkEamMcDsvjiEYjs,YEpZ43gBMzTJAduTs,2024-04-23T16:22:23Z,,,,30,female ,i was confused most of the time.,could have payed more ,,,other
ogWhW2oR8ubGwi4De,a3M6FuKNZfExNa5gp,rnDSiWpQBZjjMw3A4,2024-04-23T17:00:45Z,team,,strongly agree,,,,,,Yes,
4DESYC5n9D2tDS8en,a3M6FuKNZfExNa5gp,rnDSiWpQBZjjMw3A4,2024-04-23T17:01:57Z,,,,42,Male,Below average.,Yes.,,,bachelor
5zPMNau4bKdrjS2Tw,hTYT62e75BjHwpLTd,5RArAbS9NZL4hnu4m,2024-04-23T18:10:05Z,individual,true,disagree,,,,,,No,
rjQ653XQzCyyRxR25,hTYT62e75BjHwpLTd,5RArAbS9NZL4hnu4m,2024-04-23T18:10:45Z,,,,80,male,fair,no,,,bachelor
aHoHjCFvuFfbHQbjR,tssAovorAbMHCTHNy,fR5SqZHLCDz2kzkzp,2024-04-23T18:13:16Z,individual,false,agree,,,,,,No,
jp8epoL52Dx4kjKjj,tssAovorAbMHCTHNy,fR5SqZHLCDz2kzkzp,2024-04-23T18:13:35Z,,,,37,FEMALE,MEDIUM,YES,,,master
RCYsmnKxcf55o3JRn,tDDY2qBonWCG2cTEM,Etark9mxWevuqRdXb,2024-04-23T18:16:55Z,individual,true,strongly disagree,,,,,,Yes,
TuvS4zEMyAFiGpzwg,tDDY2qBonWCG2cTEM,Etark9mxWevuqRdXb,2024-04-23T18:19:51Z,,,,35,male,very weak,yes,,,master
tkXigTWRKcFeJsPs6,3w9nCejnhT3nZAv3d,GRdkEsecs5HRBd2XY,2024-04-23T18:24:33Z,individual,,agree,,,,,,Yes,
5qo8Ta3oqo2uRudBQ,QbRbsbK6qiY78uSEZ,G9zGdmBttzpkNi4wR,2024-04-23T18:26:01Z,team,,strongly agree,,,,,"I appreciate the opportunity to provide feedback on the gameplay activity. Here are my thoughts:\n\nThe notification about the activity was clear and timely, which helped me prepare and participate effectively.",Yes,
t86kTHNLyrspFYedD,QbRbsbK6qiY78uSEZ,G9zGdmBttzpkNi4wR,2024-04-23T18:26:52Z,,,,30,MALE,YES,YES,,,master
ibqcH4gnWSk9tTKby,3w9nCejnhT3nZAv3d,GRdkEsecs5HRBd2XY,2024-04-23T18:26:58Z,,,,52,MALE,Some games were easier than the others. I feel like I scored better in games that involved words than the ones involving logical reasoning which I felt needed more time,Yes,,,bachelor
xw9KX6FzQJdq2QxAh,hk_4cfb16857ef9ff6a,Etark9mxWevuqRdXb,2024-04-23T18:29:06Z,individual,false,strongly agree,,,,,"I was notified by email. I want to play more, as it was funny!",Yes,
5xfZz8RkqhnpZik7D,dBBxYwMkvuoZgeswe,Etark9mxWevuqRdXb,2024-04-23T18:29:31Z,individual,false,disagree,,,,,Bird was completely absent doing nothing in some rounds and actively working against us in others.  It was infuriating trying to do this with one guy working against us.  ,Yes,
eMDMxgm5mddEqxT68,hk_4cfb16857ef9ff6a,Etark9mxWevuqRdXb,2024-04-23T18:30:10Z,,,,26,male,I tried to cooperate.,Yes,,,other
5fAfYPi8dEcFfcpHq,dBBxYwMkvuoZgeswe,Etark9mxWevuqRdXb,2024-04-23T18:31:34Z,,,,43,Male,I actually did the tasks unlike some people.  I consistently worked at solving things.,"No,  not at all.  It may have been if both my third team member wasn't working against us.",,,high-school
6jR6zkfanecFDL8zf,J7zEeTSXY3n9JqKGf,u9cugqmK8yNAcRwpN,2024-04-23T18:35:21Z,individual,false,disagree,,,,,The pages reloaded and errors popped up often making it difficult to follow along.,No,
b9gBR42LewiF6GyoC,KwBLEsvWzngu9LPuS,u9cugqmK8yNAcRwpN,2024-04-23T18:35:35Z,team,true,agree,,,,,At the start of the second game the game froze and I had to click the link on the email to resume the game.,Yes,
33kZyM45uGX9hnN8P,J7zEeTSXY3n9JqKGf,u9cugqmK8yNAcRwpN,2024-04-23T18:35:47Z,,,,51,female,I am quick.,No.,,,high-school
m3S6BGNcQgScuWwZN,5gSXeCgsiwSFmnMhZ,hk_398eb1ff4aa9c7fc,2024-04-23T18:36:09Z,team,true,strongly agree,,,,,Enjoyed participating. It was loads of fun and very challenging.,Yes,
