_id,playerId,gameId,createdAt,data.synergyPreference,data.teamViability,data.enjoyedTask,data.age,data.gender,data.strengthInGame,data.payFair,data.feedbackOpenEnded,data.feedbackMultipleChoice,data.education
ciqQjHqhPM82mWzGP,MrQBNmod4A6N6qm6c,hk_398eb1ff4aa9c7fc,2024-04-23T18:36:15Z,individual,true,agree,,,,,The server seemed to have issues a lot,No,
4ccv5P3XLRJMoD2u3,jQBSuEpYekjt9zjEy,JJncbFy2MbPPctJDD,2024-04-23T18:36:15Z,team,true,strongly agree,,,,,no,Yes,
LTLHFLBfdnAi5HyrS,f628nWFtTsmJJgHzP,JJncbFy2MbPPctJDD,2024-04-23T18:36:19Z,team,true,strongly agree,,,,,great,Yes,
2inpkjG5XWGvx5kWc,NGFsL85XJaTWaYyMs,JJncbFy2MbPPctJDD,2024-04-23T18:36:20Z,team,true,agree,,,,,It was OK.,Yes,
ad5BRED2Y8RgWbJkQ,KwBLEsvWzngu9LPuS,u9cugqmK8yNAcRwpN,2024-04-23T18:36:34Z,,,,46,Male,Being able to work with the other players.,I think the pay was fair for the amount of games we played.,,,bachelor
ZjPikkDxpT6z2NwKQ,EEY2joEqh2TjL4E2a,JJncbFy2MbPPctJDD,2024-04-23T18:36:38Z,team,true,agree,,,,,"I was notified with very little warning, which is rude considering how long the task was. I enjoyed the chat feature as I could commiserate with others in my position. ",Yes,
kSrEotTPQoQdbvAKs,P6QvcwRTw3dj2fuqn,JJncbFy2MbPPctJDD,2024-04-23T18:36:44Z,team,true,agree,,,,,"The logical elimination interface was a bit confusing, especially with five animals banging on it at the same time.",Yes,
EDpbFejijFocKtJED,NGFsL85XJaTWaYyMs,JJncbFy2MbPPctJDD,2024-04-23T18:36:50Z,,,,47,MALE,Communication skills,The payment was fine,,,high-school
T4wZM6PrXLeSNKvzN,jQBSuEpYekjt9zjEy,JJncbFy2MbPPctJDD,2024-04-23T18:36:54Z,,,,40,male,none,a bit low,,,bachelor
bnK9sQhZa6fkdXM46,rLarfZZeebjvfAfSu,hk_398eb1ff4aa9c7fc,2024-04-23T18:36:54Z,team,true,strongly agree,,,,,"I wish there had been an email earlier in the day to tell me to look out for another message closer to the actual task. I nearly missed it and only caught it because I happened to check my email. Other than that, super interesting task.",Yes,
ohuDZQ6ppg7YS5hWZ,f628nWFtTsmJJgHzP,JJncbFy2MbPPctJDD,2024-04-23T18:36:59Z,,,,31,female,I am good at typing.,"It could be better, but still good.",,,bachelor
bc4KkwL4Qrq6T5M7Z,MrQBNmod4A6N6qm6c,hk_398eb1ff4aa9c7fc,2024-04-23T18:37:04Z,,,,41,female,I was willing to do my best. I am good with word unscrambles also,It is decent. ,,,bachelor
mmhjfM4AaiSdB8AXn,bMBdRAtpNCBuH5veS,JJncbFy2MbPPctJDD,2024-04-23T18:37:09Z,individual,false,agree,,,,,,Yes,
hk_1524ca0dae6fec0a,P6QvcwRTw3dj2fuqn,JJncbFy2MbPPctJDD,2024-04-23T18:37:09Z,,,,35,female,great,pretty fair,,,high-school
JdDTHruKYXb7two4q,EEY2joEqh2TjL4E2a,JJncbFy2MbPPctJDD,2024-04-23T18:37:25Z,,,,50,Male,I was not the smartest person but I did my best to stay engaged and helped when I could.,"I don't know what the final payment is yet, so I can't answer that. ",,,high-school
H6pbEWDR96y2ZR3Jx,rLarfZZeebjvfAfSu,hk_398eb1ff4aa9c7fc,2024-04-23T18:37:40Z,,,,45,cis female,I think I held up my end. I'm glad I had team members to pick up my slack and I tried to be supportive of them as well.,Very fair. This was super interesting and engaging as well.,,,high-school
N5Lve8LTybz8LGSPM,5gSXeCgsiwSFmnMhZ,hk_398eb1ff4aa9c7fc,2024-04-23T18:38:29Z,,,,49,Female,"I think I did a good job of pulling my weight in all of the tasks but the one where we had to solve the puzzles with the little x and check mark board. Thank goodness, we had a great teammate to help us out on that one.",I feel the pay was fair. The task was a lot of fun and enjoyable. It was definitely worth participating.,,,other
rNqq7JHvXr8N83Aso,bMBdRAtpNCBuH5veS,JJncbFy2MbPPctJDD,2024-04-23T18:38:41Z,,,,37,Male,Accuracy and patience.,"I don't. I would prefer to have a better base payment and the bonus is just extra incentive, especially when I am relying on a group to perform well.",,,high-school
FotMdoSsY4WezRjmn,5X2izs4ypRdF8WBcM,u9cugqmK8yNAcRwpN,2024-04-23T18:39:16Z,team,true,strongly agree,,,,,none ,Yes,
ewYLJW8DsRL2TAYxG,5X2izs4ypRdF8WBcM,u9cugqmK8yNAcRwpN,2024-04-23T18:39:37Z,,,,37,male,average,yes,,,high-school
Gshpk35g9fwzTZ4pK,Pw3WijzCteEj4xph2,KexJHAZGNxuwCthn8,2024-04-23T18:40:52Z,individual,,disagree,,,,,No,No,
amizK75jRcNMTaG9z,Pw3WijzCteEj4xph2,KexJHAZGNxuwCthn8,2024-04-23T18:41:11Z,,,,41,Nonbinary,I don't know,No,,,master
pKQ3SyPTSEFgBknNj,GmToa4AfFZaRrpSKT,iotN2LRr56L93s6Zj,2024-04-23T18:46:13Z,team,true,strongly agree,,,,,,Yes,
CTQbfYGxywQnszNS2,Y33cvWTm3uKj3ZMHD,iotN2LRr56L93s6Zj,2024-04-23T18:46:42Z,team,true,agree,,,,,everythig was perfect.,Yes,
tZA8kEmK87Apxq5cJ,jQhXEtmWkdYChDrHe,iotN2LRr56L93s6Zj,2024-04-23T18:46:45Z,individual,true,agree,,,,,Certain parts which so confusing that I didn't even know where to start. Like the part with the x's and check marks.,Yes,
a7vtbZiQCcGAFBMQt,GmToa4AfFZaRrpSKT,iotN2LRr56L93s6Zj,2024-04-23T18:47:05Z,,,,62,Female,Typing and encouraging team mates.,Yes,,,master
fjrwyo7ychdQ6gRsi,jQhXEtmWkdYChDrHe,iotN2LRr56L93s6Zj,2024-04-23T18:47:24Z,,,,52,male,Communicating in the chat box,"yes, because I don't think we did very well.",,,high-school
jh55Ng2TnjeuBPyMe,N9FLpYdAwFM6Zr9b3,iotN2LRr56L93s6Zj,2024-04-23T18:47:47Z,individual,false,neither agree nor disagree,,,,,"I would prefer an earlier notification. I was not a fan of the puzzle ones at all, they mostly did not make sense and were missing too many clues. I would rather do these types of tasks alone than in a team. I believe that one or to members did nothing the whole time.",No,
N8vETu5Arv9ACYsaQ,Y33cvWTm3uKj3ZMHD,iotN2LRr56L93s6Zj,2024-04-23T18:48:21Z,,,,68,male,the only thing I was very good at was the last exercise. I was okay on the one before that and no good at all before that. I had great teammates.,yes,,,bachelor
KrAPG9yYrTJFdwcE4,N9FLpYdAwFM6Zr9b3,iotN2LRr56L93s6Zj,2024-04-23T18:49:11Z,,,,35,Genderqueer,My strength was in trying to keep communication going. I was also quick to find last minute solutions and edits.,"No, I feel that the base pay should've been much higher for the time involved.",,,bachelor
97YK9fMYMmiJ2GSoF,vcgQfjREwxgoZ8rXm,fR5SqZHLCDz2kzkzp,2024-04-23T18:54:25Z,team,true,neither agree nor disagree,,,,,Try to keep waiting times lower if a person in the task leaves.,Yes,
n32KwdgmYAKErQbB6,FySoFt75uAaAkXfnD,fR5SqZHLCDz2kzkzp,2024-04-23T18:54:27Z,team,true,agree,,,,,some games were more interesting and fun than others,Yes,
PvyroCiG8Qgr82Nz3,283cdXiy7Mhwv43Hv,5RArAbS9NZL4hnu4m,2024-04-23T18:54:47Z,individual,true,agree,,,,,,Yes,
Pa9v4H9CdE9EETnLA,nhcRiyCZrbWmQF2DA,fR5SqZHLCDz2kzkzp,2024-04-23T18:54:49Z,team,true,strongly agree,,,,,no,Yes,
2cxf6kZvJMJkGxnFv,mKA4P7LLfW8motScW,fR5SqZHLCDz2kzkzp,2024-04-23T18:55:12Z,individual,true,strongly agree,,,,,"I just did not like how when someone dropped we had to keep waiting \n",Yes,
9BLdGknrzWYYpLxJs,vcgQfjREwxgoZ8rXm,fR5SqZHLCDz2kzkzp,2024-04-23T18:55:13Z,,,,36,Male,The name unscrambling game,Pretty much,,,other
hk_b0013b5cd6bd5b76,FySoFt75uAaAkXfnD,fR5SqZHLCDz2kzkzp,2024-04-23T18:55:19Z,,,,44,male,decent,not great pay of over an hour work,,,bachelor
QYmjF77qt4p6DywCv,j9nb7DzuRZg8Yz8jS,5RArAbS9NZL4hnu4m,2024-04-23T18:55:27Z,individual,false,strongly agree,,,,,"everything ok and calm, there could be a clearer example in some games",Yes,
hk_359ca34a9de9610e,283cdXiy7Mhwv43Hv,5RArAbS9NZL4hnu4m,2024-04-23T18:55:44Z,,,,42,male,Memory and word scrambles are what I am good at. ,I think the pay was decent.,,,high-school
92v6wisros3zqp7YK,nhcRiyCZrbWmQF2DA,fR5SqZHLCDz2kzkzp,2024-04-23T18:56:10Z,,,,57,Female,medium,yes ok,,,other
SsbQ6eXjXgWC9gfC2,mKA4P7LLfW8motScW,fR5SqZHLCDz2kzkzp,2024-04-23T18:56:14Z,,,,53,male,I was very good with the word scramble and trying to comminicate,yes,,,bachelor
ZdndpS623ks3DKwS3,j9nb7DzuRZg8Yz8jS,5RArAbS9NZL4hnu4m,2024-04-23T18:57:00Z,,,,29,male,I could have done better,"yes, very fair",,,bachelor
qSx748LLsgMtG5Sch,F6hx9wuWay6GHCEfd,fR5SqZHLCDz2kzkzp,2024-04-23T19:15:18Z,team,false,agree,,,,,Everything seemed fine.,Yes,
aPj4izgpNmLkjWppG,F6hx9wuWay6GHCEfd,fR5SqZHLCDz2kzkzp,2024-04-23T19:15:54Z,,,,49,Male,My attention to detail and memory.,It was ok.,,,bachelor
EocfEKLJoHJiR6oi9,ehcJtfFtBqHasD9mP,oPjXMm8wRX8tu3gcs,2024-04-23T19:43:42Z,individual,,strongly agree,,,,,Very well set up,Yes,
oMYZBkxfCrDY5juhR,ehcJtfFtBqHasD9mP,oPjXMm8wRX8tu3gcs,2024-04-23T19:44:10Z,,,,56,Female,"Good in parts, terrible in others!",Yes,,,bachelor
Ez3S3vqxvxnGkpLgC,GT7MwuqcxC2d2XbjD,6PwgKEvWePBq9p7D8,2024-04-23T19:49:52Z,individual,,strongly agree,,,,,,Yes,
LwTSeWC37ihvctRy7,GT7MwuqcxC2d2XbjD,6PwgKEvWePBq9p7D8,2024-04-23T19:50:06Z,,,,26,Female,Average,Yes,,,bachelor
7okTobXY7BYvii3Ac,7Akkkvo8L7pwXpwzb,mZFseNy3ZBqamCFSn,2024-04-23T19:52:45Z,team,true,agree,,,,,no,Yes,
nurufx5EQefRzuZdd,GQo3ZZbnDZuPGHsjG,mZFseNy3ZBqamCFSn,2024-04-23T19:52:48Z,team,true,agree,,,,,The last one was so confusing,Yes,
fbuoGngoTwk2YiRsb,j93h2yEvXCKvWixcC,mZFseNy3ZBqamCFSn,2024-04-23T19:52:50Z,team,true,strongly agree,,,,,I have no feedback.  I enjoyed my group.,Yes,
sKFi8HG6AdGT7B6R7,6tWQNDd7pxWmyrd74,mZFseNy3ZBqamCFSn,2024-04-23T19:53:02Z,team,true,agree,,,,,"The last task is painful, and need way more instruction than what was given.",No,
5ABvQyh9iTzAgDSxo,Bz7TQ22BNAjmPM73J,mZFseNy3ZBqamCFSn,2024-04-23T19:53:03Z,individual,true,strongly agree,,,,,last game was tough,Yes,
atpswPawWC2LNfdWj,iL32AtSj6YDRJbGHa,mZFseNy3ZBqamCFSn,2024-04-23T19:53:10Z,individual,false,disagree,,,,,"If these were real people interacting with me, how are they functioning in the real world?! This would have been so much easier as an individual task",No,
Xa5NY9nj476jNtvMg,GQo3ZZbnDZuPGHsjG,mZFseNy3ZBqamCFSn,2024-04-23T19:53:11Z,,,,60,female,medium good,Yes,,,high-school
hk_223cda5be578a449,6tWQNDd7pxWmyrd74,mZFseNy3ZBqamCFSn,2024-04-23T19:53:19Z,,,,25,Male,Mild,Sure,,,bachelor
rspAmFD4psjN6Ldfy,Bz7TQ22BNAjmPM73J,mZFseNy3ZBqamCFSn,2024-04-23T19:53:43Z,,,,42,Male,Team work,Yes,,,master
QACsqanpLCcz3gGHW,iL32AtSj6YDRJbGHa,mZFseNy3ZBqamCFSn,2024-04-23T19:53:53Z,,,,29,Female,I'm good at word games ,I'm not sure what my pay was yet. Nor do I understand how I'm going to receive it,,,master
Z7k8McAAkf8oZKSWr,7Akkkvo8L7pwXpwzb,mZFseNy3ZBqamCFSn,2024-04-23T19:53:58Z,,,,39,male,I did well on the first few tasks,"No, I've not made nearly as much as I thought.",,,bachelor
zuuFDrpKwFYN86TQN,j93h2yEvXCKvWixcC,mZFseNy3ZBqamCFSn,2024-04-23T19:54:00Z,,,,37,male,I like I was a good team member and that I could type quite fast at the typing portion.,I do.,,,high-school
cCzjwG2dEZgnWduaJ,85rsPwvZ4RMfKST2C,vqBCJGh3Dc6SMJRHn,2024-04-23T20:03:20Z,individual,,agree,,,,,One minor suggestion would be to notify game availability a little bit more in advance so that I can better schedule availability.,Yes,
2q95Jtn3xNiQSEEr5,juZ95JaBbtaggqTxa,o2Crxfw4yPw8xNDMv,2024-04-23T20:03:58Z,team,true,strongly agree,,,,,no,Yes,
Hhy7Sri9umn59PqG9,TjYmpwMPZEj8Hv6Yq,o2Crxfw4yPw8xNDMv,2024-04-23T20:04:01Z,team,true,agree,,,,,"it was fun, mindtesting",Yes,
j3wJuQa7iCJAJNWGS,juZ95JaBbtaggqTxa,o2Crxfw4yPw8xNDMv,2024-04-23T20:04:14Z,,,,27,man,finding words quick,no,,,high-school
Mz7CfuyaatemARtJj,TjYmpwMPZEj8Hv6Yq,o2Crxfw4yPw8xNDMv,2024-04-23T20:04:20Z,,,,36,female,strong with the word scramble,yes very fair,,,bachelor
xF2YJtufiF5JQq9XG,bXu9ESovvQX5JB4yz,o2Crxfw4yPw8xNDMv,2024-04-23T20:04:21Z,individual,true,agree,,,,,,Yes,
ee697fsbAivA5MJKv,RNMkss4kxTSPkM6qZ,o2Crxfw4yPw8xNDMv,2024-04-23T20:04:47Z,individual,true,strongly agree,,,,,"it was fine, just had a problem with people trying to do it all by themselves and not as a team",Yes,
WByaQhxa8ukhrpeAr,5yQdGSWRFe6th2y3g,o2Crxfw4yPw8xNDMv,2024-04-23T20:05:15Z,individual,false,disagree,,,,,"It was hard to work on the same task simultaneously with that interface, though I assume that's by design?  Also, this text box is comically tiny and narrow, like one or two words per line.",No,
e6TzP6CB7Kt7BG6e8,bXu9ESovvQX5JB4yz,o2Crxfw4yPw8xNDMv,2024-04-23T20:05:21Z,,,,54,male,below average,yes,,,bachelor
XDyNf9XZwMPi8DNXA,RNMkss4kxTSPkM6qZ,o2Crxfw4yPw8xNDMv,2024-04-23T20:05:24Z,,,,51,male,"doing the tougher answer, not the speed typing",decent,,,high-school
qYYXcJ8SeQdHK8zLc,Pb2rpHJ46WYpbLZiN,RuGJwT7H7id23j2MP,2024-04-23T20:05:36Z,individual,false,neither agree nor disagree,,,,,Not sure there was a 3rd person / not sure we were hearing the same audio,No,
wQHkwy5k3qfMwtQcD,Pb2rpHJ46WYpbLZiN,RuGJwT7H7id23j2MP,2024-04-23T20:05:49Z,,,,,,,,,,
iNA4b8s84BWG8LHLD,ni2s3pNeh8TBaz5iF,RuGJwT7H7id23j2MP,2024-04-23T20:05:58Z,individual,false,agree,,,,,Everything worked smoothly,Yes,
RbGb9r7FukZqAvx6C,5yQdGSWRFe6th2y3g,o2Crxfw4yPw8xNDMv,2024-04-23T20:06:44Z,,,,38,male,I didn't have any strengths in the game.,"not in the slightest. $6 for one hour of attentive work is insulting. If you paid better, I'd give better responses to these questions but frankly, at below federal minimum wage, i can't be bothered.",,,high-school
MtikpD2Sh3GWjv7D5,85rsPwvZ4RMfKST2C,vqBCJGh3Dc6SMJRHn,2024-04-23T20:07:35Z,,,,40,male,I felt that I performed best at the anagram portion of the game.,Yes,,,bachelor
PHkzRn7aPnBfQqEFZ,ni2s3pNeh8TBaz5iF,RuGJwT7H7id23j2MP,2024-04-23T20:07:48Z,,,,38,Female,I have good collaboration skills and I can do well in most tasks.,Yes.,,,master
zSXZRdhryufc66WpX,RbsAMCeySwcxNKxG4,FxXF4WKmLDpwhEnvr,2024-04-23T20:09:33Z,team,true,strongly agree,,,,,"Overall, the activity was fun and educational.",Yes,
EBsscsMHhsgEyKpTg,hkiL9ofq3btfBGriA,FxXF4WKmLDpwhEnvr,2024-04-23T20:09:43Z,individual,false,neither agree nor disagree,,,,,well it depends on how much i got paid to chat with an idiot while the games where not funtional,Yes,
6o8RayMwiaGAhDsYb,RbsAMCeySwcxNKxG4,FxXF4WKmLDpwhEnvr,2024-04-23T20:10:03Z,,,,51,MALE,YES,YES,,,master
rajTGkwxGQsBNQjft,hkiL9ofq3btfBGriA,FxXF4WKmLDpwhEnvr,2024-04-23T20:10:14Z,,,,47,male,communicator,I don't know until i get paid,,,bachelor
KpogHBXjSJX3bowaG,8gFzmbcaijP3yBZdY,o2Crxfw4yPw8xNDMv,2024-04-23T20:11:05Z,team,true,strongly agree,,,,,no,Yes,
8d7AvQuzsBopLq7BX,8gFzmbcaijP3yBZdY,o2Crxfw4yPw8xNDMv,2024-04-23T20:12:54Z,,,,47,female,A worker that does not mind letting someone else lead.,yes!,,,high-school
73B8QhndW9aZrGGYy,wDp7JHLREo4h5jYZE,xK5uTwivntiohLRyE,2024-04-23T20:27:24Z,team,false,strongly agree,,,,,Very entertaining. Few people on the lobby,Yes,
yvdP3QZ7TxomnAypT,nv79WR92eriewLFak,xK5uTwivntiohLRyE,2024-04-23T20:27:54Z,team,true,neither agree nor disagree,,,,,need something to indicate waiting like a moving clock or arrow,No,
p8Wsg5m44Gv9MLLqp,wDp7JHLREo4h5jYZE,xK5uTwivntiohLRyE,2024-04-23T20:28:19Z,,,,48,Male,Logic and speed,yes,,,master
FpwEzeyiFwXGAadb2,nv79WR92eriewLFak,xK5uTwivntiohLRyE,2024-04-23T20:29:11Z,,,,66,F,very poor on the last one,no a little on the low side for the length of time involved,,,bachelor
Bqq6E2Ba8gkDB2xp7,7u8eG8HNEm7nvfSbd,Fttjqn7SfwyMz6fZD,2024-04-23T21:37:00Z,individual,false,strongly disagree,,,,,Yuck,No,
FgHwF82TTuRyoE2oh,trzkFdhtMTwGYKfrN,tbToofJoFqbxwMDAB,2024-04-23T21:46:49Z,team,,disagree,,,,,no,No,
cvt2ttpscTwTsrAK3,trzkFdhtMTwGYKfrN,tbToofJoFqbxwMDAB,2024-04-23T21:47:21Z,,,,52,male,solving anagrams,"no, it was terribly underpaid ",,,master
gokL7o77pqmZqCp6j,oYLpW7Anposrog7No,45nMNo3HzEEX7EQL5,2024-04-23T22:01:58Z,team,true,strongly agree,,,,,Everything was great.,Yes,
2sf6GMJmNYwzaLYuB,BoT2ySmtpfrz4acnj,qMJb8tLr4qbhPzEye,2024-04-23T22:02:30Z,individual,,strongly agree,,,,,I was emailed a link for the game.,Yes,
FTSu44M9bXdGSD7cc,s3zMBD6kfKbRMs4jN,45nMNo3HzEEX7EQL5,2024-04-23T22:02:36Z,team,true,strongly agree,,,,,"Well, the notification came minutes before the experiment starts. I opened my notebook and started to play. Finally I got this experiment spot.",Yes,
765Awrfp4gm8qajfJ,oYLpW7Anposrog7No,45nMNo3HzEEX7EQL5,2024-04-23T22:02:39Z,,,,32,Male,Typing and word solving.,Yes.,,,bachelor
xT4oZDgidGqgpab7m,ESDRAhLiCbqBvwLB7,45nMNo3HzEEX7EQL5,2024-04-23T22:03:15Z,team,false,agree,,,,,"I think it was a good experience. The waiting room was very quick. I do wish there was a bit more time bewteen getting the email and then having the task start, but it worked out ok, because I was by my computer for the day, not having to go to work today.",Yes,
ZT3oQLqi7KEt56pnj,BoT2ySmtpfrz4acnj,qMJb8tLr4qbhPzEye,2024-04-23T22:03:47Z,,,,50,female,I tried my best to focus on the game.,Yes.,,,master
Hb6vJu5hHcsTMAFQx,ESDRAhLiCbqBvwLB7,45nMNo3HzEEX7EQL5,2024-04-23T22:04:19Z,,,,35,male,I think my strength was taking my time and reading things through. Also being willing to try things when the others were stuck.,"yes, quite fair I think",,,bachelor
wowQA6KnBvyFwvEpv,s3zMBD6kfKbRMs4jN,45nMNo3HzEEX7EQL5,2024-04-23T22:04:29Z,,,,27,Male,We talked and tried our best to find the solutions for the games. The strength was to split functions and try to resolve as a team. Every member counts.,"Yes, it was fair. I enjoyed this experiment!",,,bachelor
NgAmQ9upvY7dfo9Hq,LBeHxgJba7nJ2CvXK,ou5ukiNoAk6JLtNZX,2024-04-23T22:08:24Z,individual,true,agree,,,,,The paragraphing task was quite difficult. ,Yes,
YhHLq7pfEa8axR9EE,4faW7zC89ipcZgZPP,ou5ukiNoAk6JLtNZX,2024-04-23T22:08:29Z,individual,true,agree,,,,,No.,Yes,
gTLqvu4b8WbejCdL3,tgG5xytNTxHP8ptWt,ou5ukiNoAk6JLtNZX,2024-04-23T22:08:42Z,team,true,agree,,,,,The task went smoothly as everyone was competent and cooperative.,Yes,
g5PC9yctmQYYX36vZ,RjWTi3uxnS5LKbxEA,ou5ukiNoAk6JLtNZX,2024-04-23T22:08:42Z,team,true,agree,,,,,Some of these tasks were quite hard.,Yes,
SyQDbbwWKzmx7fYQv,LBeHxgJba7nJ2CvXK,ou5ukiNoAk6JLtNZX,2024-04-23T22:08:50Z,,,,63,male,"typing speed, organization",yes,,,bachelor
nJakz5jAd5ZsZ5k8C,uAoLxAMcMJGADFZtB,ou5ukiNoAk6JLtNZX,2024-04-23T22:09:14Z,team,true,strongly agree,,,,,fun!,Yes,
hZpyggpbZv9P5629o,4faW7zC89ipcZgZPP,ou5ukiNoAk6JLtNZX,2024-04-23T22:09:21Z,,,,53,Male,Probably the typing part.,I'll have to find that out when I see what my total bonus is. Thank you.,,,bachelor
n9jqPoH3tNyQnND93,p5PAjMKjLKympqPWo,ou5ukiNoAk6JLtNZX,2024-04-23T22:09:32Z,individual,true,agree,,,,,"Being notified about the activity only moments before it begins, results in missing out on a lot of these projects.  Maybe give more time in order for people to be aware. ",Yes,
NeWWZgEXGdLniAm9J,tgG5xytNTxHP8ptWt,ou5ukiNoAk6JLtNZX,2024-04-23T22:09:41Z,,,,36,male,Cooperation and typing speed.,It should've been a bit higher for the time invested.,,,high-school
fKMopL2aCcBwNrar2,p5PAjMKjLKympqPWo,ou5ukiNoAk6JLtNZX,2024-04-23T22:10:43Z,,,,57,Female,I think the other participants were stronger. It took me awhile to get my bearings. ,Not really,,,master
hk_5ace7df5d897a046,uAoLxAMcMJGADFZtB,ou5ukiNoAk6JLtNZX,2024-04-23T22:10:48Z,,,,46,male,medium strength,I don't know what it was. ,,,high-school
LHxTi58NBaDtLFc5x,RjWTi3uxnS5LKbxEA,ou5ukiNoAk6JLtNZX,2024-04-23T22:10:59Z,,,,49,male,I thought I was best at unscrambling words.,I thought it was a bit low for the amount of time and effort needed.,,,bachelor
EjbRAtxQRB54rtBkB,HTjQxx6tsR37z7zzK,Fttjqn7SfwyMz6fZD,2024-04-23T22:11:03Z,team,true,strongly agree,,,,,none,Yes,
tuPLZvcohGiqPtAcZ,HTjQxx6tsR37z7zzK,Fttjqn7SfwyMz6fZD,2024-04-23T22:11:46Z,,,,38,female,I was more of a helper.,yes,,,bachelor
hx3F4mqYrZqwM3gaa,bxSk6egFP2fsS56go,Fttjqn7SfwyMz6fZD,2024-04-23T22:12:05Z,team,true,neither agree nor disagree,,,,,"Notification _Sucked_.  If I hadn't just been looking at email, I'd of missed it.\n\nWaiting room had no updated status.  One person dropped out.\n\n\nStill, I really liked the tasks.\n\nTime factor wise, there wasn't enough, and the logic problem was confusing; only by the last one was it clear what was going on. \n\nShame, because it was sort of cool finally having some collaboration with my partner.",No,
vrEZDhZm3uQbFAZEs,bxSk6egFP2fsS56go,Fttjqn7SfwyMz6fZD,2024-04-23T22:14:07Z,,,,46,Male,"The typing and word descrambling... and the logic would have been, if the timer weren't so short and it was clearer how to use the interface; that got in the way of solving the puzzle.","No. The pay stinks.  You should evaluate the effort here, and pay based on that. Especially if anyone on your end ever spouts off about marginalized people --- since that's who you've got on this platform. ;/  \n\nThat said, I've done far worse and demeaning actions for less. ;P ",,,high-school
zwRtdTrnX6DoSmEj9,4B2JqEYacFbZmQrJ7,juC5t88MMkjykTa8C,2024-04-23T22:22:51Z,individual,false,strongly agree,,,,,,Yes,
ovbTzwJ7KqNKa29cB,dmLyqYXDcq4diHFhQ,juC5t88MMkjykTa8C,2024-04-23T22:22:54Z,individual,false,agree,,,,,It seemed appropriate.,Yes,
bnAKtTcqpmyByKs8M,tNGXk4H5KbKaJjJ6T,juC5t88MMkjykTa8C,2024-04-23T22:23:08Z,team,true,strongly agree,,,,,"No, it was fun!",Yes,
BksioRXYGsCZpnpSe,KWkn3bMMRPQZ6RaEw,juC5t88MMkjykTa8C,2024-04-23T22:23:08Z,team,true,strongly agree,,,,,Some of the entry screens could use some work. Especially  the mutiple typing screen.,Yes,
rGMEawtJBR7ACbu5T,Cvd5558oZCfcHPYWy,juC5t88MMkjykTa8C,2024-04-23T22:23:32Z,team,true,agree,,,,,The activity with the matching puzzle tables was somewhat confusing and may need a bit more time on the practice round to get used to how it works.,Yes,
oYCfAEu6GdRESzFHn,KWkn3bMMRPQZ6RaEw,juC5t88MMkjykTa8C,2024-04-23T22:23:42Z,,,,43,Male,A bit below average,Yes,,,bachelor
km6jvb6z5uGZMTX38,dmLyqYXDcq4diHFhQ,juC5t88MMkjykTa8C,2024-04-23T22:23:42Z,,,,56,male,Correcting mistakes.,"No, it should be higher.",,,master
SQRexZxFmTZcd2F86,RFsyW8B6QZRNKks79,juC5t88MMkjykTa8C,2024-04-23T22:23:46Z,team,true,strongly agree,,,,,"I think it was a good and enjoyable task, but I'm a speed typer and was not sure how the final task should have been handled. In the final round, I stopped typing because it seemed no one else was participating, and I was going fast and couldn't participate in the chat. Some tasks were a lot easier than others, but I had a nice time overall.",Yes,
QT8M26cwdzduGJrey,4B2JqEYacFbZmQrJ7,juC5t88MMkjykTa8C,2024-04-23T22:23:54Z,,,,51,male,I was able to figure out a winning strategy pretty quickly ,yes,,,bachelor
evZE6HzdTskunW4P5,Cvd5558oZCfcHPYWy,juC5t88MMkjykTa8C,2024-04-23T22:24:25Z,,,,47,male,"Okay, not the best or the worst.",Yes it was.,,,bachelor
NvsfHutEbQM4j3pgp,tNGXk4H5KbKaJjJ6T,juC5t88MMkjykTa8C,2024-04-23T22:25:03Z,,,,47,Male,"My strength was organizing the team, so that we could do the tasks correctly and optimally, even though we did have one player that was causing descent within the team on the last task, trying to type when they should not have been, then trying to justify it! Aside from this, the team was great!",Yes!,,,high-school
b8Yd5hhLhEwaXJfWM,RFsyW8B6QZRNKks79,juC5t88MMkjykTa8C,2024-04-23T22:25:34Z,,,,47,Female,"I feel like the typing round was the one I contributed to the most. I was an English major in college, so I'm not better with words than with logic tasks.","If it's $6 total, I think that's a little low for a task that took over an hour. But I did enjoy the task.",,,bachelor
oFnzWFKiuoJaHLRHa,DNmKDJpdPHTHzwLLy,B8iTfkZsFYXWESHZF,2024-04-24T13:25:31Z,individual,true,strongly agree,,,,,The audio and typing frustrated me.,Yes,
aeypWGaRQHG5C2dHx,DNmKDJpdPHTHzwLLy,B8iTfkZsFYXWESHZF,2024-04-24T13:25:50Z,,,,41,Female,Typing,Yes,,,bachelor
LbRAMmfmyaDStNeJp,6aMyS2YoGtBvNKKbT,B8iTfkZsFYXWESHZF,2024-04-24T13:43:42Z,team,true,strongly agree,,,,,"it was a little confusing at times, but overall  it was fun",Yes,
YtgwdDspejkt3Gt4h,7wvA6XFgWuvbvrRTz,B8iTfkZsFYXWESHZF,2024-04-24T13:44:16Z,team,true,strongly agree,,,,,General experience was good. One player disconnected.,Yes,
ptQvzajRaX6FhBMt5,6aMyS2YoGtBvNKKbT,B8iTfkZsFYXWESHZF,2024-04-24T13:44:58Z,,,,52,male,about average.  I think I did best with the letter sorting and memory,"yes, especially since it was fun.  thx",,,master
4NuhBjwkri9jJxjzq,7wvA6XFgWuvbvrRTz,B8iTfkZsFYXWESHZF,2024-04-24T13:45:01Z,,,,28,Male,I was pretty good at typing and unscramble words.,Yes it is fair for the time we invested. ,,,master
RBrnwKNApuYKEXoda,WzDKnxznurqsEdktB,zvAbFovt5m3SGHWDB,2024-04-24T13:48:52Z,team,,strongly agree,,,,,Nice experience. Willing to play again ,Yes,
EeNPe6NRmQFixd6fe,WzDKnxznurqsEdktB,zvAbFovt5m3SGHWDB,2024-04-24T13:49:43Z,,,,33,Male,Good,Yes,,,other
k4HGdojECdrMvdCfP,BHo3LW7w8BHXJi4tf,XqvmvcfdNCqWg3sai,2024-04-24T14:22:02Z,individual,true,neither agree nor disagree,,,,,,No,
hk_a990dd4c1855d239,BHo3LW7w8BHXJi4tf,XqvmvcfdNCqWg3sai,2024-04-24T14:22:21Z,,,,46,Female,Average,Yes,,,master
QkHyiEyoX39WdkY8w,cRcDjryoXKCjmTmaF,XqvmvcfdNCqWg3sai,2024-04-24T15:16:47Z,team,true,strongly agree,,,,,worked well,Yes,
eN79zELT3Mbhp57JN,6SBNuXMzNrJnjmxw2,XqvmvcfdNCqWg3sai,2024-04-24T15:16:57Z,team,true,strongly agree,,,,,,Yes,
7wNJH95HT5tuvtomL,8pn7joEHy3xjXq89L,XqvmvcfdNCqWg3sai,2024-04-24T15:17:14Z,team,false,strongly agree,,,,,I found the overall activity to be easy to understand I was notified clearly.,Yes,
rqnpGrAZyKjT4YqSP,6SBNuXMzNrJnjmxw2,XqvmvcfdNCqWg3sai,2024-04-24T15:17:24Z,,,,43,femmina,concentrata,yes,,,bachelor
RHAFAB8RZC9LK5StT,8pn7joEHy3xjXq89L,XqvmvcfdNCqWg3sai,2024-04-24T15:18:26Z,,,,30,Male,I tired to point out any issues during the games and also tried to follow along with what the majority seemed to agree with.,"The pay was alright, I don't think it was too low, however of course it could always be better.",,,high-school
5NptEoAfKr2iY6YQR,cRcDjryoXKCjmTmaF,XqvmvcfdNCqWg3sai,2024-04-24T15:18:26Z,,,,55,Male,A little weak I tried to communicate well though to get the group working together,A little low for almost an hour we got 8.00,,,high-school
YGqmFbL8iuPBkNjHR,yZC6fLXR9KWZXp28W,XqvmvcfdNCqWg3sai,2024-04-24T15:18:58Z,individual,false,neither agree nor disagree,,,,,"In the typing task, it would be nice if there was a way for each person to easily type the passage without it being complicated.  For example, if I could select any area of the space to place my cursor and type it would make it easier.",No,
wgxgbRdZjdanjrm9c,yZC6fLXR9KWZXp28W,XqvmvcfdNCqWg3sai,2024-04-24T15:20:59Z,,,,41,Male,I felt I was good at communicating and coming up with ways to make things easier. ,"Considering the time that we spent on the task, I think a little higher base pay would be better.",,,bachelor
